review_id,rating,text,language,date,park
1,5.0,"It's a beautiful park, great for walking, biking, sitting, dog walking, picnic. There are multiple entrances. Strand zuid restaurant on the Rai side is quite nice. There are some picnic benches in the dog park. There is a large play area for kids.",en,2025-09-22,Beatrixpark
2,3.0,This is a beautiful park but seems a bit unkept/ untidy. There are weeds growing through pavement cracks in the main square area of the park which is a shame. There are also lots of nettles and weeds which seem to be overtaking the natural foliage. Otherwise beautiful.,en,2025-09-07,Beatrixpark
3,5.0,"A compact, tranquil oasis of ponds, sculptures, and tree-lined paths—beautiful in every season and just minutes from the city buzz. My first stop after Schiphol; always worth the detour.",en,2025-10-25,Beatrixpark
4,5.0,"I went to this park on my rest day in Amsterdam and it was perfect. I visited in July, so the weather was very pleasant and everything was green and in bloom. I highly recommend this park.",en,2025-07-27,Beatrixpark
5,5.0,So pretty! I love the ponds and fountains and all the foliage. There were bees and ducks and other wildlife to take pictures of!,en,2025-06-28,Beatrixpark
6,5.0,"A relaxing park for picnic,jogging,walking and more. Must visit and enjoy nature!",en,2025-08-10,Beatrixpark
7,5.0,"Best dog park in Amsterdam. Also a great park for humans..... A wonderful mix of cozy, private spots and open spaces with lovely trails all throughout. Enjoy responsibly.",en,2025-04-24,Beatrixpark
8,4.0,Beautiful open field. Loads of dogs around off leash (in case your a bit scared of them). Quite serene,en,2025-09-29,Beatrixpark
9,5.0,"Beautiful park, well kept and with tons of space, so if you go with a group of friends or by yourself with a book you can always find a place and enjoy the greenery and the birds.",en,2025-07-12,Beatrixpark
10,5.0,Nice park!!!! Proper playground for kids with a pool,en,2025-09-02,Beatrixpark
11,5.0,"Very beautiful and silent place for relaxing, biking and maybe have a picnic. One of the best parks in Asterdam",en,2025-06-13,Beatrixpark
12,5.0,"Nice place to spend an evening or any other part of the day. A lot of spots for dog walking with no
leash.
Kids playground and a shallow pool could help you to get rid of your kid for at least 20 minutes. Lovely!

Barbeque is prohibited, alcohol is allowed",en,2023-09-16,Beatrixpark
13,5.0,Phenomenal park with things to do for all sorts of age. Great to take the dogs for a walk and have them off-leash. The park is kept to perfection and there are trees from all over the world. The kids play area is also very nice and with a nice cafe and pool for the summer.,en,2021-06-03,Beatrixpark
14,5.0,"Such a beautiful (and very clean) park. There are a few attractions within the park with information about the structures but, sadly, it was written in Dutch only. Still an amazing place to chill and enjoy the nature not the middle of the city.",en,2023-02-22,Beatrixpark
15,5.0,This is a wonderful park in Amsterdam south. There are a lot of trees from all around the world. If You come near to the trees You can see a description. There are also some art installations. Nice to have a time out and chill for a while. I like it and will come again!,en,2021-06-11,Beatrixpark
16,4.0,"It's a beautiful park but people and dog owners should take more care of it.
Lots of owners don't pick up the poo - I don't know what they expect to happen with it? Someone might go and sort it out?
Also there are some homeless take up their nest under some bushes - leaving rubbish behind. So the park would be beautiful and great place if people took more initiative to look after it.",en,2017-05-19,Beatrixpark
17,5.0,Lovely park for a sunny relaxing day!,en,2025-05-05,Beatrixpark
18,4.0,"It's a park, I'm not personally a big park fan but as a dog sitter i spend some time in them.  This one has a nice dog area if you let your dog off leas.  There's some nice art things if you walk around. The paths are nice and even.",en,2018-04-19,Beatrixpark
19,5.0,Small but beautiful park.,en,2025-06-26,Beatrixpark
20,4.0,"Nice park, not very large though. Plenty of room for bikes. Borders on the RAI (large event hall). There is a nice cafe with terrace on the eastern side.",en,2017-08-22,Beatrixpark
21,5.0,"It's hard not to romanticize life after a walk here, especially through the Botanical Garden. The variety of plants and flowers had me gasping in awe at every turn—there’s just so much beauty that it’s hard to believe your eyes!

But the real highlight for me was the fountain/kid pool area. Approaching it felt like a scene straight out of a movie—a glimpse of paradise. The sound of the water, families with children laughing and playing, couples enjoying ice cream, elderly visitors peacefully sunbathing...it was truly perfect. The entire atmosphere is so serene, yet alive with joy.

This spot should be high on anyone's list for a perfect day out in Amsterdam!",en,2024-09-09,Beatrixpark
22,5.0,"A beautiful park. Lots of places to sit and relax and take in the lush green views and the water around you. See people doing yoga, picnicers, cyclists, and children playing happily. Definitely one to visit for a lovely tranquil experience.",en,2023-08-16,Beatrixpark
23,5.0,"Amsterdam has many beautiful parks, but Beatrixpark is one of the most beautiful. It's a small jewel, with recreation spots for children and families, and also for those who want to just sit in a quiet place and admire the flowers and the wildlife. Unlike some other municipal parks, Beatrixpark never seems to have problems with litter or noise. It may be that it's just far enough from the center to avoid tourists and party-goers. Highly recommended.",en,2022-08-06,Beatrixpark
24,5.0,"Great place for a walk, date or hanging out with friends. Nice open areas for light physical activity (frisbee, badminton) or picnic. Nice views combining water, flowers and art.",en,2021-06-05,Beatrixpark
25,5.0,Wonderful park! Dog area is huge. Perfect for a calm walk with your doggy.,en,2024-04-29,Beatrixpark
26,5.0,"Peaceful park and good play area for kids

We had a picnic dinner near a fountain and then let our little one play in the sand box for an hour, he loved the digger.

Ducks hung out with us and there was a flock of green parakeets that kept surprising us!

Would be perfect on a hot day as there is a wading pool perfect for toddlers and young kids.",en,2023-08-12,Beatrixpark
27,5.0,Very pretty and less crowded than Vondelpark,en,2025-07-23,Beatrixpark
28,5.0,Well laid out park; great landscaping.... perfect for walking your dog (off-leash).,en,2025-10-02,Beatrixpark
29,5.0,"I visited this cool park recently. The best thing about this park is how green and peaceful it is. There are lots of trees and well-kept grass, making it a real chill spot. It wasn't too crowded, so I could actually relax.

The park's layout is quite nice with walking paths all around. It's a great place to walk or just sit and enjoy the fresh air. You can bring a blanket and have a little picnic with your friends.

To be honest, I couldn't find anything bad to say about this place. It's just an all-around awesome park with no downsides for me.

So, if you're in the mood for a laid-back and peaceful time in nature, check out this park. 🌳🍃",en,2023-07-31,Beatrixpark
30,5.0,"Named after Queen Beatrix and built in 1938, Beatrixpark, located in south of Amsterdam is one of the nicest parks in Amsterdam. It's really lovely, clean and quiet. It's a great place to spend some time walking, jogging, cycling, walking the pooch, enjoying a picnic, relaxing and even a pleasant route when commuting to/from work.

There's a lake, a number of ponds, canals and bridges, well established tall trees, and extensive well-maintained lawns and garden beds. As well as many sculptures and artwork throughout the park, there are also many facilities such as a small swimming pool and playground for the kids, a fitness area, public toilets, and a nice cafe with a terrace.

The style of the park has changed over the years but still today it's a beautiful green space behind the RAI Conference Centre and large exhibition halls. Beatrixpark is well maintained and is highly recommended.",en,2018-01-29,Beatrixpark
31,5.0,"Lovely city park with lots of ponds, trails, field and hidden paths. Nice for a morning or evening walk. Dogs are welcome",en,2019-08-31,Beatrixpark
32,5.0,"Found this park accidentally while looking for the zoo (Long story!), it's a beautiful park with parakeets flying about... Very lovely!",en,2024-02-09,Beatrixpark
33,4.0,"Beatrixpark is a nice patch of rural space east of Amsterdam Zuid Station and west of RAI that makes for a nice place to get away from the chaos of the city.

Here you find nice walking trails through open fields, along watersheds and wooded areas. There is open water with waterfowl, open fields of spring blooms as well as a few children's play areas within the park.

We spent just over an hour walking the trails of Beatrixpark and really enjoyed the frequent seclusion found. It is considerably more rural than Vondelpark and has far fewer visitors which is nice. Give it a visit the next time your in this area of the city.",en,2019-07-03,Beatrixpark
34,5.0,"Great park! Stumbled upon this gem randomly on my way to a nearby Japanese restaurant, and immediately fell in love. Don't miss the Water Lilly fountain.",en,2022-08-05,Beatrixpark
35,5.0,One of the most beautiful and peaceful parks I have ever been to.,en,2024-05-19,Beatrixpark
36,5.0,"Lovely park, beautiful trees! Definitely a great dog park, but there’s always place to chill on your own as well.",en,2023-06-13,Beatrixpark
37,5.0,"We loved it here.
Away from the tourist-buzz, easily accessible on public transport.

A very peaceful oasis.",en,2023-08-19,Beatrixpark
38,5.0,Brilliant park to let the dogs run loose (in the off leash area). Even met some old corgi friends for our girls to play with.,en,2024-11-01,Beatrixpark
39,5.0,"Lovely park, even with a bit of rain, and a few spots for the kids to stop and play.",en,2019-07-16,Beatrixpark
40,5.0,"What a gorgeous park!
It’s a good option to walk, bike, walk with your dog and enjoy the amazing views: canals, trees, flowers, etc. I also like it because there are more local people than in others parks, i.e. Vondelpark.",en,2020-11-10,Beatrixpark
41,5.0,"Great place for a walk, especially if you bave a dog. There are some vast areas to put the dog off-leash and play together.
Sometimes, people with pets gather around and bring their dogs to play together as well.",en,2021-10-16,Beatrixpark
42,5.0,"Awesome park with canals, play area and swim baths for kids.",en,2019-04-11,Beatrixpark
43,5.0,"Perfect for small kids and adults! Playground  and pool, great cafe with delish ice cream",en,2025-07-11,Beatrixpark
44,4.0,"a lovely park with many trees and roads, so it feels even larger than its actual size.",en,2023-06-18,Beatrixpark
45,5.0,"Beautiful park, great for adults, kids and dogs. It's very clean and very spacious.",en,2018-05-21,Beatrixpark
46,5.0,"Beatrixpark in Amsterdam is a serene and inviting green space ideal for relaxing or taking a leisurely walk. With its well-maintained paths and tranquil ponds, it's a perfect spot to unwind and escape the city’s hustle.",en,2024-08-02,Beatrixpark
47,5.0,"Great dog park, plenty of space for doggos tu run and friendly company too.",en,2025-01-09,Beatrixpark
48,5.0,"Beautiful park, perfect for quick lunchtime walk and strolls in between meetings.",en,2022-11-16,Beatrixpark
49,5.0,One of the most beautiful parks!,en,2024-08-06,Beatrixpark
50,5.0,The appetizers were flavorful and set the tone for the meal perfectly.,en,2025-09-25,Beatrixpark
51,5.0,"Beautiful park, very clean and kids friendly. I had the impression that is not really dog friendly.",en,2019-04-07,Beatrixpark
52,5.0,Beautiful park with wonderful play area for young kids.,en,2025-07-17,Beatrixpark
53,5.0,"nice nature, clean air, you can relax with your family, I liked everything",en,2025-07-07,Beatrixpark
54,5.0,"Perfect place to spend a hot summer afternoon. Many people were gathering in small groups - drinking, eating...- A very good alternative to other busier Amsterdam parks",en,2019-07-03,Beatrixpark
55,5.0,Beautiful place to hang out and enjoy the peace of the moment.,en,2025-09-16,Beatrixpark
56,5.0,"Very nice  quiet place, feel the prayers...and a well equiped shop (books in many languages) plus friendly nurses.",en,2019-12-28,Beatrixpark
57,3.0,A beautiful park that’s not as famous and crowded as the Vondelpark. Nice lion statue for drawing.,en,2024-09-06,Beatrixpark
58,4.0,"Nice park, different parts and atmospheres. Lovely art and landscaping. A true local and well loved park.",en,2017-06-07,Beatrixpark
59,4.0,"Not as busy as the Vondelpark, while still offering a lot of greenery, relaxing places and nice views around the water.",en,2017-05-05,Beatrixpark
60,5.0,Nice park,en,2025-07-30,Beatrixpark
61,5.0,Beautiful green space with nice trails!,en,2023-11-24,Beatrixpark
62,5.0,Favorite park of the dog!,en,2025-06-30,Beatrixpark
63,5.0,A lovely park for experiencing a quieter side of Amsterdam’s green spaces.,en,2025-08-29,Beatrixpark
64,5.0,A quiet place to walk your dog or have a picknick.,en,2023-04-30,Beatrixpark
65,4.0,A little bit overgrown but so pretty and safe feeling.  We watched the gymnaestrada march past and it was so festive.,en,2023-08-01,Beatrixpark
66,4.0,Nice small park to walk during lunch break,en,2023-05-02,Beatrixpark
67,5.0,"Near to Amsterdam Zuid Station (bus/tramp), beautiful place to walk and ride bicycle 🚲, close to World trade center.",en,2023-06-16,Beatrixpark
68,5.0,Nice park in the zuid with children's pool and playarea and lots of nature.,en,2021-07-15,Beatrixpark
69,5.0,"Beautiful park with several special landscaping section, it’s like walking through different gardens.",en,2023-06-10,Beatrixpark
70,5.0,"Great getaway spots in the city.
Excelent view of ducks building their habitat.",en,2025-06-07,Beatrixpark
71,5.0,"I lost my bag , wallet in this park.
If someone find, please contact me.Is about documents.",en,2025-08-15,Beatrixpark
72,5.0,Cannot overstate how impressive this little park in Amsterdam is… wonderful pathways and beautiful public art,en,2023-07-28,Beatrixpark
73,5.0,"A very beautiful park, absolutely recommend to head there for a weekend stroll.",en,2020-12-15,Beatrixpark
74,5.0,"Good for having a picnic, enjoying sun in sunny days and ofcourse all green spaces. Doesn't matter how crowded can be, you can find a serene place to relax and enjoy your time.
In simmer or good weather is good for families for kids to play with water and a sandy playground next to it.",en,2024-05-14,Beatrixpark
75,5.0,It is small park and suitable for taking a walk.,en,2021-04-03,Beatrixpark
76,4.0,Nice big park,en,2025-05-24,Beatrixpark
77,5.0,"My favourite park in Amsterdam. It is really beautiful, relaxing, great for biking, taking a walk or for a picnic. Some stunning sights, birds and bunnies there.",en,2019-08-08,Beatrixpark
78,5.0,Beautiful atmosphere in the city. We love spending time there!,en,2022-07-17,Beatrixpark
79,5.0,"beautiful, calm place, ideally sized, not huge but not too small",en,2025-05-18,Beatrixpark
80,5.0,Another beautiful park in Amsterdam. This one feels a bit secluded with tall growth around the paths.,en,2022-09-23,Beatrixpark
81,4.0,Very nice. The best place for picnik in Zuid,en,2018-08-05,Beatrixpark
82,5.0,I just love it here to be with my dog!,en,2025-10-19,Beatrixpark
83,5.0,"Beautiful park with a nice mix of big trees, large grass areas and water.",en,2022-09-11,Beatrixpark
84,5.0,"Small park, nice walking routes, art and benches everywhere.",en,2021-03-24,Beatrixpark
85,5.0,One of the best parks in Amsterdam. No turists and lot of birds and trees.,en,2019-06-26,Beatrixpark
86,5.0,"Lovely, peaceful park",en,2022-07-24,Beatrixpark
87,5.0,"We love this park so much. Great for all ages. There is a lovely splash pool, beautiful wooden play structure and huge sandbox. The surrounding green space is perfect for a picnic. The forest areas make for fun exploring with the kids. We go here at least once a week.",en,2020-07-16,Beatrixpark
88,5.0,"Great park, not too full of people, nice kid pool.",en,2022-07-10,Beatrixpark
89,4.0,"A nice park to go with kids, family, pets and practice sports.  A little crowded",en,2021-05-30,Beatrixpark
90,5.0,"Medium-sized park with plenty of walking, you can cover the park within 1 hour or 2 if you walk leisurely. There is a wide open area mostly with dogs (and their owners of course), as well as a big fountain within a lake. Also a small kids' playground.",en,2021-10-24,Beatrixpark
91,4.0,"Big and quiet park around business center. Very nice to walk with huge trees, ponds and channels. There is a playground and lawns. The park is not perfectly manicured but this gives some natural beauty. There are not many bicycles so walking is safe 😀",en,2022-10-22,Beatrixpark
92,5.0,"Loved this place on a sunny day. Kids play freely in a safe environment. There is a kiosk with decent food and drinks. Located right behind the RAI convention hall, so most convenient for those parents who attend conferences and need a quick respite for their kids.",en,2023-06-27,Beatrixpark
93,5.0,"It is a beautiful park, full of nature. It has a lake with some ducks and other birds, a green field for dogs to run freely, a small playground for kids and a pool for kids to play during summer time. It is a quiet park, with birds and canals crossing it.",en,2017-11-25,Beatrixpark
94,5.0,"My favorite park in Amsterdam. It's never too packed, but also does not feel deserted. There are parts that really feel like middle of nature and not a man made park.
My dog loves it too.",en,2023-11-19,Beatrixpark
95,5.0,"Great place for the families who have toddlers and small kids. Sand pit, playground and shallow water pool make them happy. Family can have a picnic around the pool. There is a small kiosk next to the pool which is convient for parents.",en,2023-05-18,Beatrixpark
96,5.0,"It's a large park that we only walked through. We walked by an area with the canal, then by a big field, then by a nicely shaded area and another big field. We wished we had more time in this park, because it seemed like a nice spacious area to lay out a blanket, take a nap, read a book or simply have a picnic at....that will be next time.",en,2020-08-28,Beatrixpark
97,5.0,"There is no need to come here, gentle readers of this review. Please go to (or, also very likely, stay at) the Vondelpark.
This is a park that is really not for you, despite what my five-star rating might imply. You see, it's still mostly quiet and cozy and clean and ... Well, maybe you could take a quick look, but only when I'm not there.",en,2023-08-18,Beatrixpark
98,5.0,"Great place to take a rest, train your body, meditation, train Joga and play with your family and friends.",en,2021-06-07,Beatrixpark
99,5.0,Very cute park,en,2023-07-11,Beatrixpark
100,5.0,Very beautiful park and close to Zuid station,en,2017-05-02,Beatrixpark
101,3.0,"Nice park. A bar inside will provide to all of your needs. Very clean. Many persons come for sports, practising running, fitness martial arts and many things. The place is quite big and it's perfect for a break in the middle of green.",en,2019-08-11,Beatrixpark
102,5.0,Can spend the whole afternoon walking around and they have a coffee stall to relax with a hot drink,en,2021-01-12,Beatrixpark
103,5.0,Super relaxing oasis right in the middle of busy Amsterdam streets.,en,2025-06-25,Beatrixpark
104,5.0,"The park is amazing with all those trees! Playgrounds and dog areas too. Very good place to take a walk, cycle with your friends/family or just chill for a bit.",en,2022-08-26,Beatrixpark
105,5.0,"My secret getaway, forget vondel that is packed with tourists. I will name my first child Beatrix.",en,2018-07-08,Beatrixpark
106,5.0,Favorite dog park in Amsterdam. Lots of other big dogs and a big opening where they all play. There is even a small spot in the water they go to cool down.,en,2024-05-05,Beatrixpark
107,5.0,"Beautiful to sit, walk and learn about the environment. Also huge dog Park!",en,2025-02-04,Beatrixpark
108,5.0,"It's a beautiful park that's got some great trees which are even labelled for your interest. Not to mention that it has a Café called Bibi, which is in the middle of the park, and sells delicious coffees and freshly baked patisserie. A great park to get away from the crowds too.",en,2022-01-15,Beatrixpark
109,5.0,"This is one of the largest parks in the city. It doesn't not get too busy, like the Vondelpark. There are several ponds and canals, and lots of large grassy areas. An excellent park to take your dog or a book and enjoy some peace and quiet. They have lovely flower gardens as well. Highly recommend!",en,2017-02-04,Beatrixpark
110,5.0,A great place to walk. Also you can leave your dog off leash here. On the weekends you will get many other dogs to play with.,en,2023-10-14,Beatrixpark
111,5.0,It's a relaxed park hardly no rubbish,en,2019-07-31,Beatrixpark
112,5.0,This is a spacious green park and less busy than most other parks in Amsterdam. Great for picnics. Also nice playground with toddler pool with fresh water on sunny days where you can also get a snack (and visit the bathroom 😉),en,2019-05-24,Beatrixpark
113,5.0,Nice for a picnic or just a promenade; beautiful and fresh. Lots of rabbits,en,2019-07-14,Beatrixpark
114,5.0,"Lovely evening picnic canal side, watching the boats go by.",en,2020-08-22,Beatrixpark
115,4.0,"Mostly undiscovered by tourists, a little treasure of the city . A dokters garden full of medicinal herbs (not for picking),  and great variety of labeled trees.not as Vondelpark but it feels like it with it's large open fields where dogs can roam free and a doggy beach for them to swim .. There is a  childrens pool open in summer and a small playground open all year",en,2018-03-15,Beatrixpark
116,5.0,"A lovely quiet park to wander and relax in, popular with runners and dog walkers.",en,2017-09-06,Beatrixpark
117,5.0,Nice park to walk your dog. Has water around centre area with bridges. This way dogs cannot exit the park while off the leash. Lots of o5her friendly dogs and owners also.,en,2020-01-19,Beatrixpark
118,5.0,"Beautiful, lovely park. Visited Amsterdam for a 4 day weekend to see some good friends. Went for a lovely walk with my friends 2 dogs through this park, one I haven't been through before despite over 20 visits to Amsterdam. Very nice, pleasant and clean and tidy",en,2020-01-21,Beatrixpark
119,5.0,Incredible city park with biking and running trails. Play area for kids is small but clean and well-provisioned. Peaceful ponds with sitting areas nearby. Highly recommended.,en,2018-12-31,Beatrixpark
120,5.0,"Loving this gentle, expansive park which is so doggy and kiddy friendly!
Our fave thing to do is to grab a very affoedable ice cream from the Bea Cafe and jump into the free splash pool on a hot day there.
On cooler days, its still so much fun to hang in the trees, play in the playground or nature spot throygh the lovely, ambient friendship gardens",en,2022-07-30,Beatrixpark
121,5.0,"I would give this place 10 stars. I used to live right next to the park, and although my apartment was small, the park made things a lot brighter. It has a lot of green with beautiful canals, with boats cruising along them. In spring, you can even see some cherry blossoms! The wildlife is so rich, you can commonly see rabbits in spring and summer and the occasional squirrel, as well as a ton of birds and insects. You can see frogs and even, if you go there a lot, turtles. I know this because I saw one in Beatrixpark before. I highly recommend this park in a thousand years.",en,2022-04-19,Beatrixpark
122,5.0,Good contrast between contemporary architecture and Nature.,en,2021-11-07,Beatrixpark
123,5.0,"Quiet and clean, well maintained and a joy to spend time chilling and medium long walks are possible. It has a well kept refined and inhabited by a rare collection of plants botanical garden. A children's playpool and adjacent a small playground. But most spectacular artworks find a place as well. Big mindboggling and magnificent sculptures on which you can read up.",en,2019-04-28,Beatrixpark
124,3.0,This is a pleasant relaxing park. Many dogs are walked here. No special features but is easy to walk along smaller paths and sit quietly.,en,2019-08-02,Beatrixpark
125,4.0,"Lovely freen areas, few sculptures in the park was not possinle to locted as they were not on the naps didpkayed in the park.",en,2024-09-18,Beatrixpark
126,5.0,"Amazing park 20 minutes walk from my home a little of everything regarding nature swimming for dogs, trails for kids and never seems over crowded",en,2024-05-19,Beatrixpark
127,5.0,"Very big and spacious, but way less people than Vondelpark. Definitely gonna take my friends here next time!",en,2024-07-25,Beatrixpark
128,4.0,"Beautiful green spaces, though not too many kids play utilities,  but overall they will enjoy. Good for a relaxing walk , should look beautiful  during the fall",en,2020-09-15,Beatrixpark
129,5.0,"This is my most favorite park in Amsterdam. There is something magical about it. No tourists, just people spending some time in the sun with their dogs. It's a beautiful changing canvass of colors throughout the year. The park is divided into different sections; there's a play area for kids, a large off-leash area for dogs and a bicycle route for commuters who like to take the scenic route to work.",en,2016-11-08,Beatrixpark
