review_id,rating,text,language,date,park
130,4.0,Very nice and diverse park. The big meadow is one of my favourite dog walking spots. Friendly other dogs and dog owners and a large nice field.,en,2019-04-21,Beatrixpark
131,5.0,"Beautiful Space, nice walk and plenty of places to sit and enjoy the surroundings. Very peaceful place nice change from hussle and hussle of the city.",en,2024-04-18,Beatrixpark
132,5.0,Great place for children to paddle in the pool. The water is changed every day and a lifeguard keeps on children. There’s also a coffee place to grab a toasti with a drink. Definitely recommended!,en,2021-07-03,Beatrixpark
133,5.0,My favourite park of Amsterdam.,en,2021-12-22,Beatrixpark
134,5.0,"This park always gives me the feeling I'm not in the middle of Amsterdam. The skyscrapers disappear and then you're surrounded by trees and nature. And it's not just us that enjoy it here, dogs love to be here too! So they have enough playmates to burn off their energy. There's a paddling pool, a kiosk and drinking water stations here and there.",en,2021-07-13,Beatrixpark
135,5.0,"Nice, clean, well-maintained park with free public toilets. The large paddling area is especially good for kids. Food and drink is also sold here.",en,2017-08-12,Beatrixpark
136,5.0,Family friendly park with great walking paths and a nice playground for the kids,en,2024-08-11,Beatrixpark
137,3.0,Had a nice date since it looks very cosy. Until the plants started to spread their spores into my eyes and nose. Do not recommend if you have hay fever.,en,2021-07-25,Beatrixpark
138,5.0,"Nice park to walk to dog, to relax on sunny day or to do some sport activity",en,2024-05-19,Beatrixpark
139,5.0,Beautiful park! shallow pool next to the playground is great for kids to play especially in the summer time. Good place for family to have quality time.,en,2018-05-08,Beatrixpark
140,5.0,"Love this park. Unlike Westerpark/Vondelpark, this one has many spots that is more quiet (close to private area), and not too crowded/loud.

So, if you wanna mind your own business, care about respecting others need for more peace (&vice versa), and care about keeping surrounding clean, then I highly recommend this place!",en,2020-08-12,Beatrixpark
141,5.0,"My favourite place for toddlers: from the open pool on the warm days, to huge green areas for picknicks, playground and sand area. Very green and beautiful and free of tourists. Literally, only locals with kids. And there is a very friendly kiosk serving everything from tasty sandwiches and tosties to drinks and ice creams.",en,2018-05-11,Beatrixpark
142,4.0,A beautiful Park in the Zuid Area to have a relaxed evening walk or a peaceful run. It also has Bath Pool which is a great summer activity for the kids on a warm day.,en,2021-08-12,Beatrixpark
143,5.0,"Another perfect park in Amsterdam . Dog friendly so we could take our dog there. Friendly chilled people, plenty of room to allow lots of dogs and very safe, also plenty of room to have a picnic. CleaN, spacious and great coffee and icecream vans. A wonderful place to picnic and spend time in the spring sunshine with friends, family and your dog.",en,2022-04-18,Beatrixpark
144,5.0,A nice and large park that is mostly quiet and not overcrowded. It has a great baby/toddler pool that's filled with fresh water on sunny days.,en,2019-05-12,Beatrixpark
145,5.0,"The story behind Willem getting to marry Maxima in one picture taken in the Beatrixpark… I see what you did there, Beatrix!",en,2021-06-24,Beatrixpark
146,3.0,"The best part is the water play area for small children on a hot day. The concessions stand is also great providing top notch refreshments, bathrooms and swimming nappies for those who have firgitten them.",en,2019-12-21,Beatrixpark
147,5.0,"One of my personal favorites, usually not too busy and with enough architectural diversity to escape the city.",en,2020-08-02,Beatrixpark
148,5.0,Great place for kids!,en,2021-06-06,Beatrixpark
149,4.0,"Great place for toddlers, small cafe to get take always from.
Looks like changing cubicles-not sure how they work.
WC ? I need to check next time we take our little one.",en,2021-07-08,Beatrixpark
150,5.0,I live this park. It was so green and pretty and not crowded. There is also a space where dog owners bring their dogs there to let them play and run. So it’s a great spot for dog watching ^^.,en,2019-05-12,Beatrixpark
151,5.0,"Quite, clean, Not the best in Amsterdam But by feet it is very Relaxing.",en,2018-11-19,Beatrixpark
152,5.0,"Had an amazing time, nice park. Different locations to chill out or be active.",en,2024-06-28,Beatrixpark
153,5.0,"Favorite dog park of people from this part of town, to be avoided if you're appalled by free ranging canines or dog owners whose eyes are glued to a smartphone, but do go there if you enjoy playing dogs in a beautiful setting.",en,2015-11-16,Beatrixpark
154,5.0,"Beautiful mid sized park behind Rai convention centre. It has cute little canals, bridges and enough green to play around with your dog or chill with some friends.",en,2019-05-31,Beatrixpark
155,5.0,Nice park with benches. Great for a break during a cycling tour.,en,2024-08-27,Beatrixpark
156,4.0,"It's probably my favorite park in Amsterdam, and my favorite public kids pool. You have all kind of spots in the park, coffee service with healthy snacks for children, routes to walk camly, fields to have picnics, a big extra area to practice sports and that is very trendy now for adolescentes and young adults. Nice views to the water and canal, nice atmosphere and people, often with good behavior. Hiden spots to get some distance with friends or alone in middle of beautiful big trees. This park has a nice hug variety of tall trees with good maintaining shape.",en,2020-05-21,Beatrixpark
157,5.0,"Fantastic for Dogs.!
PEPSI loves it there.
GG",en,2025-04-16,Beatrixpark
158,5.0,"Excellent park for warmer days. Playground recently refurbished, awesome kids pool, affordable snacks (healthy choices included), sandbox.... what more can you ask for.",en,2020-12-05,Beatrixpark
159,5.0,My favorite park! I go there often for a run or just to read a book in the grass. Very chill and has a safe vibe,en,2023-06-17,Beatrixpark
160,5.0,Amazing place to chill out with kids esp when it's Sunny. Kids love being in the swimming pool for 2- 3hours and treat themselves with flavoured ice cream from the stall next to the pool.,en,2018-05-09,Beatrixpark
161,5.0,Excellent park. Lot of nature and trails. There is playground and small shop to get drinks or snacks. During summer kids can play in the water,en,2017-04-19,Beatrixpark
162,5.0,Quiet place to go with family and friends,en,2025-05-11,Beatrixpark
163,5.0,One of the most beautiful Forest parks.,en,2018-07-22,Beatrixpark
164,5.0,"Beautiful park to walk around, enjoy nature, landscaping views and breath fresh air. Perfect for dog’s lovers and animal lovers.",en,2021-01-17,Beatrixpark
165,4.0,"Very artistic park. A lot of kunst. Has a zwembad for the kiddies to swim. Had also a lil playground for the kids. I love, it's a pity though you can't do no barbecuing there!",en,2019-04-26,Beatrixpark
166,5.0,Nice park. Good mix of shadow and sunshine on a sunny day. Not so crowded. Quite a hidden treasure as it’s close to office buildings of Amsterdam Zuid.,en,2018-10-27,Beatrixpark
167,4.0,Great park with some nice spots for having a picnic or playing sports. There is a also an area for dogs to play and a splash pool for kids.,en,2021-08-07,Beatrixpark
168,5.0,Super nice place,en,2019-08-07,Beatrixpark
169,5.0,"Very nice park in the zuid area of Amsterdam. Also many dogs, so perhaps is good to make pawfriends if you have a pet.",en,2023-10-18,Beatrixpark
170,4.0,"Lovely Park with small lakes and kids playgrounds. Taking a walk here is guaranteed to destress you and clear your head.
Nature at its best within a city.",en,2019-08-26,Beatrixpark
171,5.0,"A tranquil place with foot bridge, some sculptures and small fountains that give a serene atmosphere. The greenery keeps all year round providing a deep sense of peacefulness.",en,2019-10-08,Beatrixpark
172,5.0,"A quiet, average sized park, with great, tall trees, fountains and lawns to play, many birds with nests. Perfect for relaxation, recharging yourself.",en,2017-07-12,Beatrixpark
173,5.0,Súper nice one.. I don’t get why people would put low stars to this park. I personally prefer to have this beautiful green area than some more buildings,en,2019-03-12,Beatrixpark
174,4.0,Peaceful near busiest Amsterdam Zuid location..relaxing,en,2025-05-06,Beatrixpark
175,5.0,Wonderful - we were there with our dog and I love it that you can let them run there 😊,en,2024-07-08,Beatrixpark
176,5.0,"Nice park for relaxing, there are lot of path for running and jogging as well. Overall good place to enjoy pleasant morning.",en,2021-04-16,Beatrixpark
177,5.0,"Visited Amsterdam 25-27 September 2016 3 rd trip and it didn't disappoint. Always make a point of visiting green space when travelling and Amsterdam has some of the best green areas in Europe. Beautiful place, atmosphere was amazing some lovely people stopped to talk and it made my day. Well worth a wander if staying in the area.",en,2016-10-07,Beatrixpark
178,5.0,Beautiful park. Well maintained. Not crowded.,en,2024-08-23,Beatrixpark
179,5.0,"Quiet and often ignored large enough to spend an hour walking around it (if you stroll), different areas with very different vibes.
Kiddie area on the east, more teen play area in the south with the viewing tower",en,2020-12-12,Beatrixpark
180,5.0,Great place for a walk. If you wish to have a short rest on bench please mind there is not so many in the park.,en,2022-03-11,Beatrixpark
181,5.0,Nice neighborhood park! Family-friendly playground and good tracks for a short run. Big field for dogs.,en,2021-05-30,Beatrixpark
182,5.0,Great for an evening stroll,en,2019-11-09,Beatrixpark
183,5.0,Beautiful park that is not crowded,en,2019-08-30,Beatrixpark
184,4.0,"Nice park, extended and well kept (a bit too well perhaps). Great variety of trees and shrubs, many accompanied by little name tags.",en,2021-05-12,Beatrixpark
185,5.0,"One of the few parks in Amsterdam that I love. It is not as touristy as vondelpark and it is big enough to walk for quite some time.

Also a nice play ground for kids!",en,2018-08-27,Beatrixpark
186,4.0,Just a beautiful park in the city of Amsterdam. It has a low water pool for people to play in and a large sandbox. I wasjust there for 15 min. so I have not checked out the other area's,en,2021-09-16,Beatrixpark
187,5.0,"What a lovely walk we had through Beatrixpark on a 50-degree sunny day in January. It is big enough for a substantial walk, with areas for kids, and areas for dogs.",en,2018-04-26,Beatrixpark
188,5.0,"Lovely park in Amsterdam. A bit smaller and less traveled than Vondelpark, but every bit as nice. Good splash pool and playground for the kids and nice places to picnic.",en,2021-07-03,Beatrixpark
189,5.0,"The nicest park in Amsterdam, also very quiet and people don't scream but respect everyone's peace. It's so different than all the other parks and a place when you can really relax.",en,2020-05-31,Beatrixpark
190,5.0,"Wonderful paddling to take small kids when the weather is good, great playground for all year round too.",en,2022-08-30,Beatrixpark
191,5.0,"Very nice park, less known so more chill than vondelpark. It was my first time there but for sure I will come back.",en,2021-09-13,Beatrixpark
192,5.0,"Absolutely beautiful park, really nice place to go for a quiet walk amongst the plants and ponds.",en,2022-05-25,Beatrixpark
193,5.0,"Lovely park, great for kids and also with big spaces for dogs to play without being on a lead.",en,2022-11-29,Beatrixpark
194,5.0,"Good place to cycle and play with your kids. Pay attention that homeless also sleep there so your kids might present you with unexpected ""presents"" ;)",en,2019-04-13,Beatrixpark
195,5.0,"Love this park. It's big, there's a kiddy pool and playground. Dogs can run, you feel really outside of the city",en,2016-12-02,Beatrixpark
196,3.0,"It's a good park for a causal walk or bike ride. Great dog park too. Which reminds me, watch out for the dog poo minefield all over the place.",en,2015-11-15,Beatrixpark
197,4.0,"Nice and chill park, it is not very crowded like other big parks such as Vondelpark. Very nice to have a walk and to see a lot of bunnies!",en,2020-06-16,Beatrixpark
198,5.0,"The energy in this park is so beautiful. Wether walking or biking, this is a great place to connect to nature. Five stars all the way.",en,2019-09-10,Beatrixpark
199,5.0,Be aware that this is not where the Parkrun is held. The Parkrun is in Beatrixpark Almere.,en,2025-03-30,Beatrixpark
200,4.0,"Nice park, good maintenance. Just not many activities to do. But good for a walk.",en,2021-09-05,Beatrixpark
201,5.0,Beautiful park. Well looked after and clean. Walked through it daily when attending a conference at RAI. Felt safe whatever time I walked through.,en,2017-04-30,Beatrixpark
202,5.0,"Lovely little green space, not too far from the busy streets of Amsterdam.  Easy to walk to and many nice walks that you can take around the park.",en,2019-09-02,Beatrixpark
203,5.0,"Beautiful park, variety of scenery & my kid loved the outdoor pool (for kids, very shallow).",en,2021-08-02,Beatrixpark
204,5.0,"A very quiet park, but very beautiful!
Lots of dogs they can walk here freely.",en,2017-08-31,Beatrixpark
205,5.0,Nice park,en,2017-09-19,Beatrixpark
206,5.0,Nice park with both a wild section and a very groomed section. Nice for a walk when the weather allows it,en,2022-02-26,Beatrixpark
207,5.0,"Beatrix park is a very large park with nice areas for picnic, a small play area for kids with beach sand and a swimming pool with water just ankle deep. It's closer to Zuid and RAI stations",en,2019-06-16,Beatrixpark
208,5.0,"My favorite park, calm,very clean and my dogs can happily and save run and play!!!",en,2022-11-03,Beatrixpark
209,5.0,My fav park,en,2025-07-13,Beatrixpark
210,5.0,A very quiet park for families and groups to enjoy relaxing in the sun. It is also great to take a walk or exercise.,en,2020-08-10,Beatrixpark
211,5.0,Was wonderful cause the kids have too much space to play . Very quiet place!,en,2023-07-16,Beatrixpark
212,5.0,One of he nicest parks in Amsterdam. It is small but spacious. A wonderful park to do some morning exercise in.,en,2018-09-05,Beatrixpark
213,5.0,"A leafy, peaceful park with lots of dedicated cycling and walking paths.",en,2024-07-15,Beatrixpark
214,5.0,"Nice park to visit with childs, there is even a pool/fountain where kids can get in to play, among others games you might find along the park",en,2019-08-06,Beatrixpark
215,5.0,"Beautiful park, where folks walk their pets, parents play with their kids, some hobbyists even fish there",en,2018-04-09,Beatrixpark
216,5.0,This park is a smaller and a quieter version of the Vondelpark. Very nice spots to sit down and enjoy the sunset,en,2021-04-28,Beatrixpark
217,5.0,"Beautiful and serene place to meditate. Lovely church very close by, Our Lady of All Nations",en,2023-05-08,Beatrixpark
218,5.0,A very nice and serene park. We'll worth the visit,en,2020-09-13,Beatrixpark
219,4.0,"Lovely park, you can bring your kids as well your pets and spend a relaxing day in the sun",en,2017-11-07,Beatrixpark
220,4.0,Great Park with fine lake with chanel inside. Lot of trees and bicycle paths. Fresh air.,en,2022-12-02,Beatrixpark
221,5.0,Beautiful little park near the business district's offices. Loads of little nooks and crannies and canal-side grassy patches for people to explore or rest.,en,2019-07-05,Beatrixpark
222,5.0,I went for the first time. I liked it very very very much. It is quiet and no one bothers anyone with noise. a place where you can listen to yourself.,en,2021-08-21,Beatrixpark
223,5.0,Nice kid friendly park with some nice paths for a walk. Good for the sunny days.,en,2021-04-17,Beatrixpark
224,5.0,My favourite Amsterdam park. Perfect spot for letting your dog run free plus the kids paddle pool is fantastic in the summer.,en,2019-07-21,Beatrixpark
225,5.0,Wonderful place.,en,2019-04-17,Beatrixpark
226,5.0,"Wonderful park, full of nice spots from playground to grass area.",en,2022-09-04,Beatrixpark
227,5.0,Nice park. It’s nice to come here as it’s not as crowded as vondelpark but there’s still a nice atmosphere about it :),en,2018-08-24,Beatrixpark
228,5.0,One of the best and most underrated parks with multiple beautifully landscaped spaces,en,2023-07-15,Beatrixpark
229,5.0,"Smaller but much calmer than the neighbor Vondelpark, and much lower bike traffic. Perfect for a calm afternoon when the weather is good",en,2019-08-30,Beatrixpark
230,5.0,"Nice local park with children's swimming pool, very popular dog field, and a fountain.",en,2021-03-08,Beatrixpark
231,5.0,Good spot for a quiet stroll. On sunny and warm days they fill the children's pool. Easy hit!,en,2017-05-17,Beatrixpark
232,5.0,Beautiful and big,en,2023-09-05,Beatrixpark
233,5.0,Beautiful Park with a great play area for kids during the summer. Large areas to play games or with dogs!!,en,2016-07-13,Beatrixpark
234,5.0,Decently big park with a lot of play stuff for kids. The pool in the summer would be good place for kids to chill out.,en,2021-06-13,Beatrixpark
235,5.0,Beautiful and quiet park in the southern part of Amsterdam. Strand Zuid is a nice plate for a quick bite even if the service and especially the food are not the best,en,2019-06-25,Beatrixpark
236,3.0,"Small, local park. Wonderful for dogs and quick bike ride. 10km running path.",en,2016-12-03,Beatrixpark
237,5.0,"Unexpected place, beautifully designed yet a very natural feel to it. Perfect for a walk or just to sit down and observe nature",en,2021-04-18,Beatrixpark
238,5.0,Herons sighted in full force 🪶,en,2025-07-15,Beatrixpark
239,4.0,It's a good park for dog owners saw lots of people with their dogs... you would be luck if sun is out,en,2018-03-15,Beatrixpark
240,5.0,The prettiest park in Amsterdam. Resembles the gardens in Paris. In summer - kids have a small pool with a cafe and ice cream next to it,en,2019-05-15,Beatrixpark
241,5.0,Beautiful Park!,en,2020-03-06,Beatrixpark
242,5.0,"Nice little park, perfect for picnic, grilling or just hanging out on a warm day.",en,2019-07-06,Beatrixpark
243,5.0,Really the best park in Ams for off-lead dog walking!,en,2024-01-23,Beatrixpark
244,4.0,Beautiful parc to relax and have a picnic with your friends little water pound for the kids,en,2018-07-21,Beatrixpark
245,5.0,"Beautiful park, especially in summertime",en,2023-10-01,Beatrixpark
246,3.0,"It's a park. Some parts of it are kind of in disrepair, but they seem to be fixing it up to some degree. The location is nice, right next the financial district of Amsterdam (Zuidas) and the RAI convention center.",en,2020-02-16,Beatrixpark
247,5.0,"Beautiful and quiet park close by WTC Zuid. With areas designed for kids play, dog areas, kiosks and beautiful restaurants nearby",en,2019-08-06,Beatrixpark
248,5.0,"My favourite park in Amsterdam! So much variation, from grass, lakes and water through pine forests, sculpture, walking/running and cycling",en,2019-06-30,Beatrixpark
249,5.0,"Very nice park, very good for walking your dog or normal walks",en,2020-12-11,Beatrixpark
250,5.0,My fav park of Amsterdam. Great location and never too busy. Park has a small coffee place and also lido for the small kids.,en,2018-06-09,Beatrixpark
251,5.0,"One of the nicest parks in Amsterdam, Beatrixpark was created in the years 1936-1938 following the design by Jakoba (Ko) Mulder, a leading Dutch landscape architect, who was also involved in the Amsterdamse Bos project. Originally a romantic park, after the WWII Beatrixpark has been redesigned into the more modern, style of functionalism. During the German occupation, the park has been called Diepenbrockpark, after the composer Alphons Diepenbrock, who was under the influence of the music of Richard Wagner and who in his compositions used often German romantic poetry. The street along the park remained named after the composer – Diepenbrockstraat.
As after the war, the style of the park changed and so changed its name. Today, the Beatrixpark is a green space behind the RAI congress centre, which took a large chunk of the land away from the park for the construction of one of it biggest exhibition halls, called later Parkhal. Another piece of land, directly at the freeway has been added at that time (1993), to compensate the loss.
Beatrixpark is a local park - nice, clean and quiet. Small pavilions standing in the park are leftovers from the Floriade exhibition in 1972. The oldest part of the park is the nicest, as it kept its original romantic character influenced by English parks - with a small lake and open landscape. Just this part of the Beatrixpark, has received the status of the city monument in 2005.",en,2019-08-20,Beatrixpark
252,4.0,"Very nice park with a great variation of trees and plants, dog friendly!!!!!",en,2021-02-06,Beatrixpark
253,5.0,Quietplace with the amazing nature,en,2022-05-11,Beatrixpark
254,5.0,really beautiful and peaceful. I enjoyed the walk around the park,en,2022-03-26,Beatrixpark
255,5.0,"Good to run through, connect Zuid with rivierbuurt on bike, good playground for kids including swimming area in summer.",en,2017-10-25,Beatrixpark
256,4.0,"Not the biggest park, but still a good outdoor space. Not too busy and plenty of paths for walking.",en,2017-05-19,Beatrixpark
257,4.0,"Walk, cycle, sit or picnic, this place is good for all",en,2024-05-14,Beatrixpark
258,5.0,"Nice place to walk, run and spend time with kids. A small garden with named plants is in place",en,2021-08-29,Beatrixpark
259,4.0,"Nice park, more quiet than The other big Amsterdam parks. Great spot for a work out.",en,2017-06-01,Beatrixpark
260,4.0,A quite nice park where you can lay on the grass and you can pick nic,en,2022-09-05,Beatrixpark
261,4.0,Nice park with lots of green and a nice playground nearby with a swimming pool for toddlers,en,2019-05-02,Beatrixpark
262,4.0,Awesome 👍,en,2022-02-25,Beatrixpark
263,5.0,I love this park! It has everything for a pleasant visit with the family.,en,2020-08-01,Beatrixpark
264,5.0,Lovely place to walk around and spend time. Worth visiting,en,2023-04-05,Beatrixpark
265,5.0,"Awesome silent place at the lake. Perfect weather and chilling in the sun, listen to the natures volumes. Love it ;-)",en,2012-07-08,Beatrixpark
266,5.0,It is one one of the best Park in the middle of the City. Best place for your walking exercise....,en,2020-07-05,Beatrixpark
267,4.0,Pretty nice park. Easy to overlook but worthwhile to visit.,en,2017-06-04,Beatrixpark
268,5.0,"A beautiful park, perfect for taking your dog for a walk or going for a jog!",en,2019-11-27,Beatrixpark
269,5.0,Beautiful park in Zuid. Great for walking and doggy's.,en,2023-03-22,Beatrixpark
270,5.0,Perfect for dogs and also those who like to run or do sport activities in not overcrowded place!,en,2017-11-16,Beatrixpark
271,5.0,Very nice place,en,2025-05-08,Beatrixpark
272,5.0,Many green areas where people just let the dogs to chase toys,en,2024-07-20,Beatrixpark
273,4.0,Was ha d to find public toilet. Otherwise amazing park with great facilities for kids,en,2019-04-20,Beatrixpark
274,4.0,Lovely park. Easily accessible. Nice place for jogging,en,2018-01-28,Beatrixpark
275,5.0,Well maintained park.,en,2025-03-11,Beatrixpark
276,5.0,The oldest modern park in Amsterdam.  Opened in May 1938. Lots of trees and statues.,en,2021-10-04,Beatrixpark
277,5.0,Calm and nice place to relax and do a brick walk,en,2024-09-14,Beatrixpark
278,5.0,Well maintained park with opportunity for walks up to an hour,en,2023-07-04,Beatrixpark
279,5.0,I love this park. It is my favourite in Amsterdam. Clean. Big. Perfect for a day out with family and friends.,en,2019-06-04,Beatrixpark
280,5.0,Amazing park but toilets are open until 6 PM,en,2022-09-13,Beatrixpark
281,5.0,"Wide, quiet, shadows & fully sunny ... One more miracle in Ams",en,2024-05-17,Beatrixpark
282,5.0,Fun park cute and great for walking your dog.,en,2022-05-01,Beatrixpark
283,4.0,it is a very nice place although a few years back there was a murder there but still i give it a 4 star. the murder was on the dock .,en,2017-04-18,Beatrixpark
284,5.0,The park is incredibly quiet and nice. The canals going through the park are super clean!,en,2019-09-18,Beatrixpark
285,5.0,Beautiful park. Very quiet compared to central ones.,en,2022-09-17,Beatrixpark
286,5.0,"Beautiful, quite and with perfect playgrounds incl. the one with a swimming pool for kids.",en,2018-09-19,Beatrixpark
287,5.0,"One of my favorite parks in Amsterdam. Beautiful, clean and cozy.",en,2023-07-20,Beatrixpark
288,5.0,Very nice city park. Visit on a sunny or rainy day and relax,en,2020-08-29,Beatrixpark
289,5.0,"Nice park that isn't too crowded, especially not compared to some of the other parks in Amsterdam.",en,2020-09-21,Beatrixpark
290,5.0,Great park to visit if you don't want the crowds at Vondel!,en,2021-03-07,Beatrixpark
291,4.0,"Beautiful park located next to Zuidas. Worth a visit, a stroll and a drink in one of the adjacent restaurants.",en,2018-06-29,Beatrixpark
292,5.0,Great park.big also and some Nice places to sit.,en,2019-12-08,Beatrixpark
293,5.0,"Beautiful park, especially in spring, when trees are blooming",en,2021-08-07,Beatrixpark
294,5.0,Our favorite park in Amsterdam 😍,en,2019-06-23,Beatrixpark
295,4.0,Really nice park and pool for kids. They loved it.,en,2020-09-08,Beatrixpark
296,5.0,"Very nice park, not crowded!",en,2022-07-27,Beatrixpark
297,4.0,"A little busy, but lots of nature and feasible to keep social distancing",en,2021-05-31,Beatrixpark
