review_id,rating,text,language,date,park
608,5.0,"Beatrixpark is (wellicht gelukkig maar voor de kenner) een relatief onbekend park, maar erg mooi en stadsdeel Zuid-waardig. Mooie natuur en watertjes, voldoende zitplaatsen en leuke paadjes.",en,2024-07-11,Beatrixpark
609,4.0,Kleine groene oase in de Rivierenbuurt aan de rand van de snelweg. Veel mensen uit de buurt laten hun hond hier lekker rennen. Leuk kinderbadje in de zomer.,en,2021-02-20,Beatrixpark
610,5.0,"Mooi park, voor elk wat wils. De hondenuitlaatplek is echt leuk, met een koffie karretje waar heerlijke espresso en zelfgebakken koekjes worden verkocht. Genoeg bankjes om lekker in het zonnetje te zitten ☀️.",en,2020-12-02,Beatrixpark
611,5.0,"Prachtig park, fijn om in te wandelen en rustig. Leuk veld waar honden met elkaar spelen.",en,2021-04-30,Beatrixpark
612,5.0,"Mooiste park van Amsterdam,  schoon en netjes en zalig om met mijn 2 berners doorheen te wandelen",en,2019-03-03,Beatrixpark
613,5.0,"Prachtig park, mooi onderhouden, een diversiteit aan bomen en planten. Heerlijk park om een rondje te wandelen. Op het honden veld is een waterpunt wat echter een lekke leiding heeft. Water stroomt het veld op.",en,2025-02-12,Beatrixpark
614,4.0,Leuke tent .. met redelijke prijzen en leuk en vlote medewerkers!! zie je niet zovaak meer in 020 ! lol,en,2025-08-11,Beatrixpark
615,5.0,Είναι καλό πάρκο. 6/10 Ευτύχης Μπλέτσας,en,2025-10-10,Beatrixpark
616,5.0,"Een van de vele mooie parken in Amsterdam. Waterpartijen, kunstobjecten, mogelijkheid tot sporten, kinderbad met speeltuin. Heel aangenaam",en,2021-01-31,Beatrixpark
617,3.0,"Der Park ist schön angelegt. Die Bäume hoch gewachsen, es gibt einen Teich. Leider ist sehr viel Hundekot überall. Es stinkt also teilweise sehr. Es gibt viel zu wenig Sitzgelegenheiten. Man hört immernoch das deutliche Rauschen der Autobahn und des Zugverkehrs. Echte Erholung ist so leider nicht möglich. Schade! Der Park hätte sehr viel Potenzial !",en,2024-07-21,Beatrixpark
618,5.0,"Ons favoriete poedelbadje voor de kinderen, lekker elitair, snufje zuid, favoriete speeltuin en in het park mag je hond los.",en,2022-09-04,Beatrixpark
619,5.0,"J'ai adoré ce parc ! Il est spacieux, apaisant, bien entretenu et on peut y croiser de gentils promeneurs de chiens !",en,2019-08-30,Beatrixpark
620,5.0,很漂亮的當地居民公園,en,2019-08-24,Beatrixpark
621,5.0,"Parque muy bonito con muchos árboles, varios con sus nombres. Tiene juegos para niños pequeños, lagunas y caminos peatonales y para bicibletas.",en,2023-04-24,Beatrixpark
622,5.0,"Como todos os parques de Amsterdam, super limpo, agradável e bem sinalizado.",en,2019-05-14,Beatrixpark
623,4.0,Prachtig park op loopafstand van de bewoonde wereld. Netjes onderhouden. Afwisselend met grote velden en kleine plekjes aan het water. Honden mogen hier los lopen en kunnen zwemmen in de verschillende vijvers. Prima sfeer!,en,2024-08-26,Beatrixpark
624,4.0,Fijn park om met de hond te lopen.,en,2025-09-08,Beatrixpark
625,5.0,Geweldig mooi park waar kleine hondjes ook los lopen. Heerlijk om te wandelen,en,2021-11-27,Beatrixpark
626,4.0,Met zonnetje erbij leeft het park weer op.,en,2018-10-17,Beatrixpark
627,4.0,Mooi aangeplant park met paviljoens in Amsterdam-zuid,en,2025-10-24,Beatrixpark
628,4.0,Leuk park om even door te wandelen. Veel bedrijvigheid van mensen/kinderen die er lekker spelen en vertoeven.,en,2025-03-07,Beatrixpark
629,5.0,"Великий красивий парк, похожий на ліс.",en,2023-04-16,Beatrixpark
630,5.0,"Ligar muito lindo e arborizado, visitamos no inverno, mesmo assim estava muito verde e bonito, muito limpo e organizado também. As criança amaram o parque",en,2025-02-15,Beatrixpark
631,5.0,"Mooi maar niet te groot stadspark met apart hondenuitloopveld, peuterbad  met kiosk en heemtuin",en,2023-09-24,Beatrixpark
632,4.0,Heerlijk Park. Was met mijn puppy daar op de hondeweide. Ze ontmoet vele andere honden.,en,2019-09-24,Beatrixpark
633,5.0,Mooi aangelegd park met bijzondere bomen en heesters.. overblijfsel van de Floriade.. prachtig aangelegde en onderhouden Artsenijtuin..,en,2017-05-16,Beatrixpark
634,5.0,"Гарне місце,затишно і спокійно…",en,2023-03-20,Beatrixpark
635,4.0,Heerlijk park. Fijne omgeving.,en,2022-11-12,Beatrixpark
636,5.0,Очень зелёный (впрочем как и весь Амстердам) парк средних размером. Есть небольшой батонический садик на теретори. Фонтаны скамейки и места для отдыха.,en,2024-12-04,Beatrixpark
637,5.0,"Тихое чистое прекрасное место в любое время года, одинаково подходящее тем, кто хочет совершить утреннюю пробежку, выгулять собаку или почитать книгу в одиночестве на природе. Есть большие открытые пространства и тенистые аллеи, артобьекты. Очень удобный публичный бассейн. Можно встретить группы людей, занимающихся разными видами физического самосовершенствования. Моя особая любовь - небольшой ботанический парк.",en,2023-07-16,Beatrixpark
638,5.0,Piye yo...arep nulis opo! Kota tp taman taman nya banyak. Ruang terbuka hijau nya luas. Kapaaan.. orang Indonesia mindset nya seperti orang belanda ya.,en,2025-01-20,Beatrixpark
639,4.0,De Artsenijhof is een verborgen parel en zeker een bezoek waard voor wie interesse heeft in medicinale planten.,en,2023-06-18,Beatrixpark
640,5.0,"Krasny rozlehly park s jezirky a spoustou prostoru pro piknik, venceni psu, jizdu na kole, prochazky...",en,2018-08-14,Beatrixpark
641,5.0,"Eerste park dat ik bezocht in Amsterdam, vanwege de grootte en grandeur is het moeilijk om de mooie dingen die ik zag te beschrijven. Het hele park is een uitnodiging voor een romantische wandeling, met familie, vrienden of zelfs alleen... Zeer ruim in zijn afmetingen die toegankelijkheid geven aan iedereen die er vaak komt. Ik kon zien dat er natuur werd gevormd rond het water, dat begint in een meer waar in het midden een klein eiland is, een hoek van de vogels. Naast de verschillende soorten bomen en planten die zich aan de drie zijden door kanalen in al zijn dimensies uitstrekken.

Ik ben benieuwd om het op het hoogtepunt van de lente te observeren, vooral in de rozentuin en ook in de kruidentuin. Door de ingangen prachtige monumenten van leeuwen, die het gevoel geven dat daar de bewoners van deze plek veilig en beschermd zijn. Naast het vertegenwoordigen van alle kracht en moed gevonden door degenen die hetzelfde idealiseerden om de moeilijkste obstakels en moeilijkheden te overwinnen.",en,2023-04-16,Beatrixpark
642,5.0,"J'adore ce parc. Il n'est pas très grand mais propose plusieurs chemins avec des recoins très tranquilles et sauvages. Il est assez peu fréquenté même en été, et dispose d'espaces assez variés : chemins ombragés, fontaine, grande pelouse centrale et espace pour les enfants (jeux et bassin d'eau). On y trouve une petite buvette.",en,2021-07-26,Beatrixpark
643,5.0,"Fijne plek om met Teddy, de hond, heen te gaan in het weekend. Het is een mooi park en er is ruimte en een groot veld waar hij zich volledig vermaakt. Mooie plekjes om te zitten en er zijn veel vogels te zien. Vergeet daarom vooral de nootjes of zaadjes niet!",en,2023-04-17,Beatrixpark
644,5.0,Sehr schön angelegter Park direkt am RAI Amsterdam.,en,2024-06-28,Beatrixpark
645,5.0,"Ótima infraestrutura, conservação, ambiente muito agradável, ótima opção para estar em contato com a natureza.",en,2017-09-20,Beatrixpark
646,4.0,"Prachtig park, de bomen staan vol in de bloesem en ik werd getrakteerd op een waar fluitconcert van de vogels.",en,2019-04-17,Beatrixpark
647,5.0,Mooi park waar nog echt RUST heerst in tegenstelling tot de meeste andere stadsparken in Amsterdam,en,2022-11-18,Beatrixpark
648,5.0,Prachtig zo midden in de drukte waar je helemaal niets van merkt. Heerlijk park.,en,2021-09-24,Beatrixpark
649,5.0,Ik kwam hier al als kind van plm. 7 jaar oud en kom er nu graag met mijn kleinzoon,en,2021-06-16,Beatrixpark
650,5.0,"Perfekter Park für Naturliebhaber*Innen Sportler*Innen  und Kinder. Der Park ist zu großen Teilen wild gewachsen, wodurch man sehr viele einheimische Pflanzen und Tiere erspähen kann. Es gibt verschiedene Sitzplätze (mit Tisch), Spiel- und Sportplätze und einige Trinkwasserspender. Durch den ganzen Park verlaufen Rad-und Fußwege in Top Zustand.",en,2021-08-06,Beatrixpark
651,5.0,"Prachtig aangelegd park. Op een steenworp afstand van het Vondelpark maar aanzienlijk minder druk. Ook is het erg leuk dat er een veld is waar iedereen zijn hond loslaat. Het is wel een park met erg veel doorgangetjes en bosjes, wat niet al te handig is als je eigenwijze teckels hebt. Dat is iets om rekening mee te houden, maar verder is het een heerlijk park.",en,2020-03-27,Beatrixpark
652,4.0,"Rustig park, velden, heemtuinen, peuterbad en zoveel meer.",en,2019-01-10,Beatrixpark
653,5.0,Geweldige plek om kleine hondjes los te laten lopen.,en,2021-07-11,Beatrixpark
654,5.0,"Ontzettend leuk park in Amsterdam, nabij de Rai. De kinderen vermaken zich prima in het bad en de speeltuin.
Een heerlijke weide om te picknicken, met veel schaduwrijke plekken.
Een hele fijne plek om te vertoeven met kinderen!",en,2021-06-27,Beatrixpark
655,5.0,"Bel parco curato, con piscina alta qualche cm per far rinfrescare i bambini. Area giochi molto curata e pulizia ovunque. Anche i servizi si sono rivelati sempre pulito",en,2022-09-04,Beatrixpark
656,3.0,"Groteweide voor zelf te verzinnen aktiviteiten, mogelijkheid om te barbeqeuen, feestje te geven of in alle rust te genieten van rozentuin, veldjes aan het water, romantische wandelpaden, honden mogen op veel plaatsen los. Tevens peuterbad. Niet een heel groot park.",en,2017-08-26,Beatrixpark
657,5.0,"Schöner Park zum spazieren gehen und radfahren. Ein toller Spielplatz für die Kinder und im Sommer gibt es einen Pool.  Toiletten sind vorhanden und kostenlos. Es gibt einen Kiosk wo man Kaffee, Eis sowie Sandwiches und Croissants erhält. Dieser hat familienfreundliche Preise.  Werden wir wieder besuchen 🙂",en,2022-04-10,Beatrixpark
658,5.0,"Een heerlijk park dat ligt tussen de RAI en de Zuidas. Twee plaatsen die een kookpot van stress en bedrijvigheid zijn. Dan dat heerlijke park waar mensen uit de buurt de hond uitlaten. En samen komen, soms met koffie, als de koffiebar er staat.
De rest van het park is heerlijk rustig en uitgekiend ingericht. Met speciale vegetatie.
Geen BBQ toegestaan.",en,2019-08-16,Beatrixpark
659,4.0,"Leuk pierenbadje. Wel zelf speelgoed meenemen. In de ochtend nog lekker rustig. Maar op mooie dagen is het om 10.30 al druk! Als de grotere kinderen komen, is de lol er voor de hele kleintjes snel af. Dus met de ukkies, vroeg gaan, dan is het top!",en,2021-06-13,Beatrixpark
660,5.0,"Heerlijk park voor de hond (en zonder). Netjes aangelegd, voorzieningen aanwezig, goed bereikbaar.",en,2024-03-12,Beatrixpark
661,4.0,Mooi park lekker rustig,en,2022-10-10,Beatrixpark
662,5.0,Mooi groen park midden in Amsterdam waar je veel soorten mooie routes kan lopen over de verschillende paadjes. Er staan heel veel verschillende bomen die allemaal een naambordje dragen. Ook is in de zomer het kinderbadje geopend en staan er door het park heen verschillende kunstwerken. Heerlijk park om tussen de middag een lunch-rondje te wandelen!,en,2019-04-24,Beatrixpark
663,5.0,"Mooi en schoon park, ideaal om een rondje te lopen met of zonder hond. Is altijd een relatief rustig park. Vroeger ook vele uren doorgebracht spelen in de speeltuin en in het badje.",en,2018-04-22,Beatrixpark
664,5.0,Mooi opgezet park en rustig voor Amsterdamse begrippen.,en,2021-04-18,Beatrixpark
665,3.0,"Heel erg leuk park in de zomer met het pierenbadje. Parkeren is echter niet te doen. Max 1 uur en ontzettend duur! Hoe kan je zoiets bezoeken als je van verder weg komt? Heb ontzettend mn best gedaan om op tijd terug bij de auto te zijn en alsnog een boete ontvangen. Park is dus duidelijk alleen bedoeld voor mensen die in Amsterdam wonen en dan is het een prima plek om een middag met kids te besteden.
Bij kouder weer is het speeltuintje wel wat aan de kleine kant om ook mijn zoontje van 6 te behagen. Dochter van 2 zou het ook dan prima naar haar zin hebben hier.

Verder mooi aangelegd.. prima toeven..",en,2018-08-05,Beatrixpark
666,5.0,Heerlijke plek voor Tai Chi beoefening in de open lucht,en,2019-07-26,Beatrixpark
667,5.0,Klein park dat je in enkele minuten rondloopt. Er is een groot veld waar heel veel honden komen om met elkaar te spelen. De baasjes socializen er of drinken er koffie. Er is vaak een mobiele koffiecorner.,en,2021-10-22,Beatrixpark
668,5.0,"Prachtig park in Amsterdam Zuid met veel afwisseling qua bomen, bloemen, gras en water. Ook zijn er hoogteverschillen die echt wat toevoegen. Er is een goed restaurant (As) aanwezig, een leuk speeltuintje met horeca, brede wandel- en fietspaden. En de overgang naar de Zuidas-kantoren aan de westkant is goed vormgegeven.",en,2017-09-12,Beatrixpark
669,5.0,"Heerlijk stadspark, met verschillende veldjes om te sporten of te zonnen. Er is een leuk tentje, naast het pierenbadje die ijsjes, broodjes etc verkoopt. Niet duur en allemaal bijzondere en lekkere dingen!",en,2021-08-16,Beatrixpark
670,3.0,"zaten te pickniken, niet aan te raden, veel arogante mensen die hun hond gewoon het eten van je bord laten eten tot je hun hond wegtrekt en ze hun schouders ophalen uit desinteresse, dit is 3 keer gebeurt in 2 uur tijd, park zelf is erg mooi wel uitkijken voor ganzenpoep op veel plekken in het gras",en,2020-07-23,Beatrixpark
671,5.0,Lugar muito legal!,en,2018-10-26,Beatrixpark
672,4.0,"Mooi,rustig park",en,2020-08-08,Beatrixpark
673,5.0,清幽的大公園，可以搭車到Zuid站走過來，四面環繞河景，公園內也有類似湖泊的河道，以前這裡還有舉辦Pure Markt市集，賣很多熟食比方烤雞、漢堡、肉丸點心之類，公園中間有類似咖啡小店的休息區，旁邊有付費的公廁，離開公園後回程可以往國家博物館那區過去，欣賞沿途的其他河道跟建築，這裡算是阿姆斯特丹中心的外圍，所以建築跟住宅比較現代，途中還有一個Vredeskerk教堂，外觀看起來充滿古意，內部昏暗簡單，跟其他觀光教堂不太一樣，有機會可進去參觀。,en,2020-06-24,Beatrixpark
674,5.0,Net park. Niet te druk en prima publiek.  Wel af en toe wat honden en veel fietsers.  Strandlaken is handig voor t zonnen. Café Strandzuid is een leuke plek om wat te drinken en te happen.,en,2019-07-26,Beatrixpark
675,5.0,"Een vergeten park, maar super chill en lekker rustig, zodat je er niet uit wordt gekickt zoals bij vondel. Heeft alles wat je hartje begeert: gras, bomen, zitplekken, honden, zelfs een zwembadje voor de kids",en,2021-05-30,Beatrixpark
676,5.0,"Prachtig park, een aantal jaar geleden helemaal op de schop gegaan en sindsdien een pareltje.
Er is een hondenspeelveld, fietspaden met logische/snelle verbinding (noord-zuid en oost-west), wandelpaden in park- en bosachtige delen.",en,2019-10-10,Beatrixpark
677,5.0,"Sehr schöner, großer Park mit vielen Weihern und Teichen. Man kann viele verschiedene Entenarten und andere heimische Tiere sehen. Ausserdem gibt es dort einen Wasserspielplatz, einen Kiosk, einen großen Kräutergarten, einen Seerosenteich und viel zu Entdecken. Der Park ist ruhig und sauber, man kommt mit der Metro ganz schnell hin.",en,2018-08-08,Beatrixpark
678,5.0,"Lindo lugar, ainda com canteiros de plantas medicinais , maravilha.",en,2021-08-23,Beatrixpark
679,5.0,Prachtig stukje natuur tussen al die kantoren eromheen. Ben erg blij dat ik hier elke dag doorheen mag fietsen. Als de zon schijnt kan je ook nog een lekker op een bankje aan het water zitten!,en,2020-01-05,Beatrixpark
680,5.0,"Parco meraviglioso... Pieno di laghetti e angoli incantevoli... Ampi spazi verdi, fontanelle con acqua per dissetarsi... Un piccolo paradiso... Vicinissimo ai mezzi pubblici.",en,2020-07-19,Beatrixpark
681,5.0,Parco bellissimo e tranquillo,en,2025-05-02,Beatrixpark
682,4.0,"Klein maar fijn, heeft alles wat een park nodig heeft. Water, natuur, dieren, zon en het is niet heel erg druk. Erg fijn park.",en,2023-05-28,Beatrixpark
683,5.0,"Prachtig park! Gisteren heb ik samen met wat vrienden heerlijk genoten van de zon samen in het gras. Tientallen honden renden rond met hun baasjes, je hoorde de vogels fluiten. Helemaal top.",en,2021-09-05,Beatrixpark
684,5.0,Heel Nice park....als de zon schijnt. Ben geen fan van regenachtige parken dus ook nie het Beatrixpark. Maar met een straatje zon en een aangenaam temperatuurtje ben ik in. Goed verzorgd. M'n kleine geniet van het speeltuintje en de ijsjes die ze er verkopen. Goed. Gewoonweg goed!,en,2021-08-05,Beatrixpark
685,5.0,Amo!!! Melhor local para levar os cachorros pra passear em Amsterdam!,en,2017-11-13,Beatrixpark
686,5.0,Leuk park vlakbij station Amsterdam Zuid. Goed bereikbaar en toegankelijk en zo in Amsterdam alsnog veel groen en water. Vlakke paden met fijne steentjes dus ook voor minder validen heel goed te doen. Echt even leuk uitwaaien en ook de omgeving even een kijkje waard voor de niet-Amsterdammer 😊,en,2021-06-18,Beatrixpark
687,4.0,"Ruim opgezet, mooie wandelpaden, aangelegde tuinen met zitgelegenheid, vijvers, grote grasvelden en interessante kunstwerken, kortom een echt gebruikerspark.",en,2021-07-03,Beatrixpark
688,5.0,Unfassbar schöner park,en,2021-09-05,Beatrixpark
689,4.0,Mooi park met veel groen en ruimte voor recreatie. Ook een lekkere plek om vanuit het werk in een van de gebouwen aan de Zuidas even een moment van rust in de natuur te pakken.,en,2020-08-07,Beatrixpark
690,5.0,لا يوجد وصف للمكان انه ببساطة رائع ونظيف ومرتب,en,2020-08-19,Beatrixpark
691,5.0,Hond lekker laten ravotten met zijn soortgenoten,en,2025-04-24,Beatrixpark
692,3.0,Teveel honden poep,en,2025-08-07,Beatrixpark
693,4.0,"Je kan er lekker wandelen Het is een mooi, goed onderhouden park. Nu(november veel lawaai van machines, voor onderhoud )",en,2023-11-16,Beatrixpark
694,5.0,"Prachtig stadspark. Niet super groot, maar precies genoeg. Honden uitlaat veld, speeltuin en zomers een peueterbad maken het geschikt voor iedereen.",en,2020-09-16,Beatrixpark
695,5.0,"Fijn, mooi en vriendelijk park",en,2021-02-08,Beatrixpark
696,5.0,Heel mooi groot park netjes alles opgeruimd. Mooi zwemgelegenheid met veilig getest water door de gemeente paar keer per dag. Top,en,2017-08-25,Beatrixpark
697,5.0,Niet zo bekend als het vondelpark wel erg mooi.  Zeker voor mensen zonder tuin.  De arme mensen die in Amsterdam zuid wonen. Wel een jaguar geen tuin. Ik heb een fiat en een grote tuin in een goedkopere  streek ja ieder zijn ding.,en,2019-06-26,Beatrixpark
698,5.0,"Heerlijk park. Ruim, hoge bomen, groot grasveld. Would picknick yes",en,2024-04-20,Beatrixpark
699,5.0,Superhärlig park! Väldigt lummig och fin med många gångvägar och vattendrag. Hade jag haft hund i Amsterdam så hade jag gått hit varenda dag.,en,2023-10-07,Beatrixpark
700,5.0,Prachtig mooi park. Let op : er rijdt iemand rond met een TucTuc die koffie verkoopt en vraagt € 10.70 voor 2 koffie verkeerd met mini koekjes.,en,2022-08-19,Beatrixpark
701,4.0,Herfst was kleurrijk in het Beatrixpark.,en,2022-10-18,Beatrixpark
702,5.0,Krásné místo pro odpočinek a procházky.,en,2021-07-08,Beatrixpark
703,5.0,"Superbe parc pour marcher, courir, faire du vélo. Idéal aussi pour les enfants, le playground est top ! De jolies photos à faire en toutes saisons.",en,2021-02-24,Beatrixpark
704,3.0,"Het is een mooi doorfietspark geworden tussen Buitenveldert en Centrum. Als je genoeg tijd hebt, zijn er ook nog wel plekjes te vinden om even teruggetrokken te bivakkeren.",en,2019-08-04,Beatrixpark
705,3.0,Het si ee leuk groot park alleen er zijn te ve3l dronken mensen of er word gerookt in de buurt van kinderen. Maar vaak word er weed gerookt,en,2021-02-20,Beatrixpark
706,5.0,Mooi park en oase van rust in Amsterdam Zuid en zomers een feest voor ouders met zeer jonge kinderen vanwege het badje,en,2024-02-20,Beatrixpark
707,5.0,"Mooi aangelegd park. Mooie paadjes om te wandelen en te fietsen. Er is een hoofdweg die breed aangelegd is. Aan die weg grenzen een skatebaan, een grote speeltuin, een midgetgolf en een snackbar.",en,2019-06-23,Beatrixpark
708,5.0,Fijn park om met de hond in te wandelen. Groot veld en veel weggetjes in de schaduw van de bomen.,en,2020-08-06,Beatrixpark
709,4.0,"Als je jonge kinderen hebt , leuke plek om te ontspannen! Er is ook een kinder badje aanwezig die gevuld word vanaf mei!",en,2018-04-25,Beatrixpark
710,4.0,Ook in de winter mooi park!,en,2020-05-25,Beatrixpark
711,5.0,Beatrixpark is een zeer fraai en relatief rustig park. Opvallend is hoeveel afval en etensresten er nu bij de bankjes en prullenbakken rond zwerft. Komt dit door de drukte in Corona tijd of hebben de aso's het park ontdekt? Voorheen was dit nooit zo erg!,en,2018-09-17,Beatrixpark
712,5.0,"Prachtig voor alle leeftijden. Kunst, speeltuinen, bloemen, zeldzaam mooie bomen, pierebad van Aldo van Eijck en doolhof. Kiosk bij pierebad met speeltuin",en,2021-05-16,Beatrixpark
713,4.0,"Erg mooi park, met veel mooie wandelroutes, wel wat lawaai van de auto's als je aan de rand van het park bent",en,2022-02-08,Beatrixpark
714,5.0,"Heerlijk park, niet de vondelpark drukte. Wel heel leuk voor kinderen, meerdere speeltuinen en in de zomer een buitenzwembad",en,2021-04-11,Beatrixpark
715,5.0,"Ik woon zo vlakbij dit park, en ik bof gewoon heel erg dat ik in mijn buurt hele mooie parken heb. Zoals het Amstelpark, die is heel rustig, en er mag niet worden gefietst. Wat heel fijn is, in t Beatrixpark wel, en er komen veel meer mensen ,maar t blijft een heel relaxte sfeer hebben. 💖💖💖💖💖",en,2019-05-06,Beatrixpark
716,4.0,Zeer erg mooi park. Kom hier vaak lopen met de hond,en,2023-07-08,Beatrixpark
717,5.0,"Leuk park, veel hondenliefhebbers die daar hun viervoeters uitlaten. Gezellig om te zien ook veel joggers en wandelaars",en,2020-06-11,Beatrixpark
718,5.0,"Ein schöner kleiner Park im Süden Amsterdam. Mehrere schöne Wege führen rund um und durch den Park.
Saubere Anlage mit einigen Sitzbänken.",en,2022-10-31,Beatrixpark
719,4.0,"Mooi park geworden. Naast picknicken, wandelen met de hond, zit er ook een afgeschermd speelplek voor kinderen.",en,2020-08-06,Beatrixpark
720,5.0,"Словами не передать, нужно гулять и смотреть своими глазами.",en,2019-01-12,Beatrixpark
721,5.0,Mooi park  heerlijk om er te wandelen,en,2024-05-27,Beatrixpark
722,4.0,منتزه كبير جدا وفي غاية الجمال من كل النواحي وهو مناسب للشواء مع افراد الاسرة,en,2021-06-06,Beatrixpark
723,5.0,"Al 30 jaar 'mijn'  om de hoek park. Eekhoorns, bosuil, afwisselende vegetatie. Ooit de Floriade, dat is nog steeds te zien aan de bijzondere bomen.",en,2017-07-01,Beatrixpark
724,5.0,"Heerlijk veelzijdig park, het zwembadje voor de kids, de weide voor de honden, fietsen langs de RAI, futuristische aanblik van de Zuidas aan de andere kant.",en,2021-11-17,Beatrixpark
725,2.0,"Er wordt overal dwars doorheen gefietst.
Erg onrustig. Zitten mooie stukjes in, maar niet groter dan 10 meter.
Waardeloos dat overal maar fietsen.",en,2021-05-09,Beatrixpark
726,5.0,"Heeeeeeeel leuk park, gezellig en prettig verblijven!",en,2024-06-15,Beatrixpark
727,5.0,"Mooi schoon Park met speelse waterpartijen, kunst en een heel oud pieren badje, intussen een keer basis ontstikkerd.",en,2021-03-02,Beatrixpark
728,5.0,Parque lindo e tranquilo,en,2017-05-07,Beatrixpark
729,5.0,Très joli parc. Calme et bucolique. On y rencontre quelque lapins. Pas trop de monde et agréable de traverser le parc en course à pied.,en,2018-05-10,Beatrixpark
730,3.0,Lopend vanaf Station Zuid kom je tussen enkele grote kantoorgebouwen ook in het Beatrixpark terecht maar ik prefereer de entree in de Diepenbrockstraat en liever in de zomer als er weer al het groen te zien is in.p.v. de kaalheid van vandaag. Een beetje somber...,en,2022-01-27,Beatrixpark
731,5.0,Fijne plek voor een wandeling! Leuke plekjes en bezienswaardigheden! Hapje en drankje ook te verkrijgen int park!,en,2019-09-28,Beatrixpark
732,5.0,Hele leuke park heel veel natuur en gewoon mooie plek om te wandelen,en,2020-07-16,Beatrixpark
733,5.0,"Maravilloso parque lejos del bullicio de otros como Vondelpark. Zonas tranquilas donde sentarte a leer, piscina para niños en verano y una explanada que es un paraíso para los perretes.",en,2021-06-26,Beatrixpark
734,5.0,"Traumhafte Lage. Eine Idylle in einer Weltstadt. Immer einen Abstecher Wert. Im Sommer ein Spaß, besonders für die Kleinen. Wasserlandschaft, Wiesen und Bäume. Einfach toll.",en,2019-09-09,Beatrixpark
735,5.0,"Een fijn park met voor elk wat wils, wandelen, zitten, hond uitlaten. Peuterbadje.
Mijn persoonlijke voorkeur: de artsenijtuin.",en,2022-05-13,Beatrixpark
736,5.0,"Lekker in de buitenlucht maar toch in de bewoonde wereld.
Goeie plek om te zonnen of ff met wat vrienden van de dag te genieten.",en,2023-07-11,Beatrixpark
737,5.0,Heel erg leuk. Er was een film opname met o.a Jan Kooiman. Mijn vriendin haar golden mocht mee doen. En ik als figurant.,en,2019-12-05,Beatrixpark
738,5.0,"Het is altijd gezellig ,om hier naar toe te gaan.Vroeger ging ik met de kinderen en nu met mijn kleindochter .Een leuke park om te gaan.",en,2018-05-19,Beatrixpark
