review_id,rating,text,language,date,park
298,4.0,A very calm park. Good to rest and catch some sun.,en,2018-05-14,Beatrixpark
299,5.0,"Cool park, quiet and winding paths leads to nice restaurant close Rai metro station.",en,2019-08-04,Beatrixpark
300,5.0,Very calm and serene park. Absolutely loved it ❤️,en,2021-05-02,Beatrixpark
301,5.0,"Beautiful park with lots of birds, hares and squirrels.",en,2020-02-03,Beatrixpark
302,5.0,Beautiful park! Had a great date with someone from Tinder here!,en,2022-06-16,Beatrixpark
303,5.0,Beautiful park. Dogs can be here of leash.,en,2021-10-15,Beatrixpark
304,5.0,Lovely park with lots of space for the kids to play,en,2020-05-23,Beatrixpark
305,5.0,Amazing place.,en,2021-10-11,Beatrixpark
306,5.0,Very nice park to take your pet for a walk,en,2017-05-29,Beatrixpark
307,5.0,"Beautiful park, especially during autumn. A must see.",en,2013-10-23,Beatrixpark
308,5.0,Wonderful place to relax and watch nice people playing with their dogs,en,2019-10-13,Beatrixpark
309,5.0,As a member of the foundation I highly recommend promoting your urban life with a spot of nature 🦟🕷🐌🦅🦆🐧🐟🦖🦎🐞🐜🐝🦇,en,2019-09-05,Beatrixpark
310,5.0,Good park. Nice kids playground,en,2022-04-24,Beatrixpark
311,4.0,It's a bit more quiet than the big parks in Amsterdam.,en,2022-06-12,Beatrixpark
312,3.0,"Beautiful park, but taken over by dogowners which means that running is risky here,",en,2017-01-03,Beatrixpark
313,5.0,Beautiful park and good spot for people watching.,en,2020-06-20,Beatrixpark
314,5.0,"When the weather's fine it's lovely to just chill out with your friends, family and pets.",en,2019-03-30,Beatrixpark
315,3.0,"Goos enough for morning run. One circle is about 5km, what wakes you up completely :-)",en,2016-08-28,Beatrixpark
316,1.0,worst park ever dont go here,en,2024-08-09,Beatrixpark
317,5.0,"Favourite park in Amsterdam, nice large dog play area and away from hustle and bustle of loud city life",en,2017-09-14,Beatrixpark
318,5.0,Very nice and good play area for kids,en,2019-01-27,Beatrixpark
319,5.0,Great with the kids!,en,2025-05-12,Beatrixpark
320,5.0,Great park for crying in peace. Recommend +++,en,2023-10-05,Beatrixpark
321,5.0,Perfect place for training or just enjoying the beautiful nature in the middle of the city,en,2020-08-12,Beatrixpark
322,3.0,Nice park. Looping paths for walkers and cyclists.,en,2018-10-26,Beatrixpark
323,4.0,Let my dog out there every day.  He has a lot of fun..,en,2021-09-14,Beatrixpark
324,5.0,Great park close to the Center and not to many people! Calm down and relax!,en,2019-06-21,Beatrixpark
325,5.0,"Nice park,quite and beatiful place to visit",en,2020-01-19,Beatrixpark
326,4.0,Great to have it connecting between Zuidas and Rai. A few cafés and ice-cream children playground.,en,2017-07-01,Beatrixpark
327,5.0,Super nice little park,en,2022-08-01,Beatrixpark
328,4.0,"Good park, no toilets as far as I could tell.",en,2018-03-27,Beatrixpark
329,4.0,Some parts could be maintained better. Overall it's decent,en,2022-10-02,Beatrixpark
330,5.0,Good greenery and wonderful park to spend time,en,2019-04-08,Beatrixpark
331,4.0,Nice for dogs. Cleaner than the other parks,en,2018-10-11,Beatrixpark
332,4.0,Beautiful area with gardens and places (museums) to visit,en,2018-02-10,Beatrixpark
333,3.0,Its a nice place to chill with family and friends tho it's very crowded,en,2021-06-10,Beatrixpark
334,3.0,A nice city park and a good shortcut for bikers and pedestrians.,en,2021-11-30,Beatrixpark
335,4.0,"Nice small park to relax, enjoy",en,2020-11-10,Beatrixpark
336,5.0,"A small park with trees, lakes and cycling lanes. Lovely",en,2017-09-06,Beatrixpark
337,5.0,The park has a unique atmosphere...,en,2023-04-17,Beatrixpark
338,5.0,Lots of greenery and tranquility in the heart of Amsterdam.,en,2024-10-28,Beatrixpark
339,5.0,Such and amazing park to take the kids to.,en,2019-03-05,Beatrixpark
340,5.0,Nice park close to the busy zuid area,en,2018-07-05,Beatrixpark
341,5.0,Wonderful and the children loves it. Specially the boat area.,en,2020-07-24,Beatrixpark
342,4.0,Lovely place for a walk during your lunch break,en,2019-10-20,Beatrixpark
343,5.0,"Nice park to walk, bike or exercise",en,2021-10-13,Beatrixpark
344,4.0,"Beautiful, well kept. Too many unrespectful bikers",en,2022-10-28,Beatrixpark
345,5.0,Amazing dog park for tons of puppy play.,en,2018-12-28,Beatrixpark
346,5.0,Great park for kids and adults as well.,en,2017-09-11,Beatrixpark
347,4.0,"Lovely park, Recommend instead of vondelpark.",en,2021-02-13,Beatrixpark
348,3.0,"Great Park, not so much of recreation",en,2018-04-21,Beatrixpark
349,5.0,Great park for a cycle and relax in the summer.,en,2018-08-28,Beatrixpark
350,5.0,Peaceful and beautiful.,en,2019-08-07,Beatrixpark
351,5.0,"Forgotten park! It’s beautiful here, something else as Vondelpark but as beautiful and relaxed",en,2021-11-16,Beatrixpark
352,5.0,"Good place to visit with kids, specially on the summer 💕",en,2020-08-08,Beatrixpark
353,5.0,Absolutely amazed by the beauty of this park. Was really surprised of the parrots that are living in the park.,en,2019-12-15,Beatrixpark
354,4.0,Quite fine but there’s no point to go there from other side of the city,en,2022-10-10,Beatrixpark
355,5.0,Pierebadje is great,en,2025-07-04,Beatrixpark
356,5.0,"Nice Park, plenty of space.",en,2021-06-20,Beatrixpark
357,5.0,Great park to take your dog.,en,2018-07-28,Beatrixpark
358,5.0,"very nice, great location for a walk!!",en,2022-04-14,Beatrixpark
359,4.0,Good Park in business district. Go for a lunch break walk!,en,2020-03-08,Beatrixpark
360,5.0,"All rounder park. Has everything a park should have, and a bit more.",en,2023-08-17,Beatrixpark
361,5.0,"Relaxed, not crowded beatiful park.",en,2019-06-09,Beatrixpark
362,5.0,"Great park, even the trees are named.",en,2020-06-25,Beatrixpark
363,5.0,"A gorgeous, quiet secret!",en,2016-11-16,Beatrixpark
364,5.0,Really pretty park lots of trees!,en,2019-07-05,Beatrixpark
365,5.0,It's a beautiful park.,en,2022-08-18,Beatrixpark
366,4.0,Nice location and quite good for an afternoon lunch time stroll.,en,2016-06-22,Beatrixpark
367,5.0,Nice place for a relaxing walk,en,2023-09-09,Beatrixpark
368,5.0,Very beautiful and quiet park.,en,2019-06-09,Beatrixpark
369,5.0,The best park in Amsterdam. Better than Vondelpark but smaller.,en,2020-02-16,Beatrixpark
370,5.0,"Great park, recently renovated. Smooth tarmac.",en,2016-10-29,Beatrixpark
371,5.0,So pretty!  Perfect for taking some time off,en,2022-09-14,Beatrixpark
372,5.0,The most beautiful park in the city,en,2017-11-04,Beatrixpark
373,5.0,Best place for dogs and people.:),en,2023-06-21,Beatrixpark
374,5.0,Had a children's party here...ideal venue....,en,2019-06-20,Beatrixpark
375,5.0,Great park for dogs and non-dogs!,en,2017-07-04,Beatrixpark
376,5.0,"A lot of animals , beautiful trees and awesome location.",en,2019-09-08,Beatrixpark
377,5.0,this is by far one of the best place for dogs and their owners,en,2016-05-29,Beatrixpark
378,5.0,Has a very nice pool for children,en,2022-06-21,Beatrixpark
379,5.0,Very green. Nice children's pool,en,2022-06-29,Beatrixpark
380,5.0,Beautiful park with a lot green,en,2022-08-08,Beatrixpark
381,5.0,Great for letting dogs off leash,en,2017-02-05,Beatrixpark
382,5.0,Beautiful large and quiet park,en,2018-07-08,Beatrixpark
383,5.0,Nice quiet park just out of the centre...,en,2019-07-16,Beatrixpark
384,4.0,Also nice coffee riksha in park,en,2023-09-21,Beatrixpark
385,5.0,Such a calm place for a picnic.,en,2018-10-07,Beatrixpark
386,5.0,Pretty & peaceful!! 😊,en,2019-05-19,Beatrixpark
387,4.0,Great to chill with pet owners and lowers,en,2023-05-13,Beatrixpark
388,5.0,Nice park to have a walk,en,2019-01-21,Beatrixpark
389,4.0,Nice n modern scultures park,en,2020-08-15,Beatrixpark
390,5.0,Relaxing and open park with kid friendly activities,en,2021-04-27,Beatrixpark
391,5.0,"Cute park, not too wide",en,2016-12-01,Beatrixpark
392,5.0,Such a lovely park for locals who hate barbeques and tourists.,en,2019-06-19,Beatrixpark
393,5.0,A quieter and smaller park to escape the tourist madness of VondelPark!,en,2018-05-27,Beatrixpark
394,5.0,Lovely park in centre of business district,en,2022-11-05,Beatrixpark
395,5.0,Super the best place to walk with your dog in Amsterdam,en,2017-08-09,Beatrixpark
396,5.0,Cozy park near the best residential area of Amsterdam.,en,2021-07-19,Beatrixpark
397,5.0,So beautiful and refreshing to walk around here!,en,2018-06-13,Beatrixpark
398,5.0,Nice spot. Great coffee cart!,en,2021-05-07,Beatrixpark
399,5.0,A very beautiful park!,en,2017-08-11,Beatrixpark
400,5.0,The little nooks are what make this park amazing.,en,2017-10-27,Beatrixpark
401,4.0,very interesting layout and an enjoyable walk,en,2017-10-25,Beatrixpark
402,4.0,Sweet little park filled with bootcampers.,en,2016-08-16,Beatrixpark
403,5.0,Nice lay out and signs describing the treespecies,en,2020-11-01,Beatrixpark
404,5.0,Beautiful!!!,en,2019-10-20,Beatrixpark
405,5.0,Excellent outdoor space that is great for a run,en,2016-12-26,Beatrixpark
406,4.0,Looks like a dog park. Not that much to do with children.,en,2017-04-18,Beatrixpark
407,5.0,Serenely spectacular,en,2019-08-03,Beatrixpark
408,5.0,Amazing place,en,2019-04-30,Beatrixpark
409,5.0,"Amazing park, my favorite in Amsterdam!",en,2020-06-07,Beatrixpark
410,5.0,My daughter Bella loves the park,en,2021-05-11,Beatrixpark
411,4.0,Great Park. Parking can get expensive though.,en,2017-04-18,Beatrixpark
412,5.0,Very big and open space.,en,2023-07-21,Beatrixpark
413,5.0,"Like most of Amsterdam it works, escape into this paradise of a park",en,2019-12-29,Beatrixpark
414,4.0,Lovely place.,en,2019-05-14,Beatrixpark
415,5.0,Quiet and dog-friendly.,en,2024-04-11,Beatrixpark
416,5.0,"Tall trees, wonderful cycling experience.",en,2018-08-19,Beatrixpark
417,5.0,Very nice park,en,2018-06-16,Beatrixpark
418,5.0,Nature beauty at its peak!!! Greenery!! Pleasant to the eyes!!,en,2019-07-03,Beatrixpark
419,5.0,Very nice park.,en,2019-09-21,Beatrixpark
420,5.0,"A favourite for running, kids and the dog!",en,2018-11-14,Beatrixpark
421,5.0,Very good place to visit,en,2023-08-04,Beatrixpark
422,5.0,Beautiful and clean park,en,2023-05-08,Beatrixpark
423,3.0,"A bit too much pathways cyclingpaths, and noise from the highway",en,2018-10-01,Beatrixpark
424,5.0,Quiet and beautiful .. a trip with your do,en,2020-01-08,Beatrixpark
425,5.0,Beautiful public park.,en,2021-12-02,Beatrixpark
426,5.0,Amazing park for dogs!,en,2016-08-05,Beatrixpark
427,5.0,Felt like a tropical paradise!,en,2023-05-06,Beatrixpark
428,5.0,Hands down the best park in Amsterdam!,en,2023-01-05,Beatrixpark
429,5.0,Great for a stroll. Easily accessible.,en,2023-02-07,Beatrixpark
430,5.0,"Very spacious, calm park",en,2017-05-19,Beatrixpark
431,5.0,Quiet place close to de city center.,en,2018-05-07,Beatrixpark
432,5.0,Top! Beautiful space for beautiful persons.,en,2020-08-11,Beatrixpark
433,5.0,Perfect nature touch in the middle of the city,en,2023-02-19,Beatrixpark
434,5.0,My favourite park in Amsterdam by far,en,2022-08-16,Beatrixpark
435,4.0,Very nice park,en,2016-09-04,Beatrixpark
436,5.0,Excellent for taking dog for a run!,en,2017-02-09,Beatrixpark
437,5.0,Peaceful. There's no other way to express how i feel when I am there.,en,2017-01-26,Beatrixpark
438,5.0,A quiet underrated Park in central Amsterdam.,en,2018-06-25,Beatrixpark
439,5.0,Great park in a quite area of Amsterdam,en,2020-11-20,Beatrixpark
440,5.0,Beautiful park,en,2024-07-22,Beatrixpark
441,5.0,Awesome for kids to play around,en,2020-09-14,Beatrixpark
442,5.0,Lots of space to do lots of things,en,2021-03-24,Beatrixpark
443,4.0,Nice place to relax almost in the centre of Amsterdam.,en,2019-06-08,Beatrixpark
444,5.0,Beautiful place,en,2017-06-14,Beatrixpark
445,5.0,Nice to walk tge doggy,en,2022-09-04,Beatrixpark
446,5.0,Very cute and great for kids,en,2020-07-26,Beatrixpark
447,4.0,Very nice space for kids,en,2020-09-16,Beatrixpark
448,5.0,Nice spacious park,en,2016-03-09,Beatrixpark
449,4.0,good,en,2023-07-29,Beatrixpark
450,3.0,Very nice  park,en,2019-09-29,Beatrixpark
451,5.0,A serene chapel with a quiet atmosphere,en,2019-12-21,Beatrixpark
452,5.0,My favourite park in Amsterdam.,en,2021-11-13,Beatrixpark
453,5.0,The most beautiful park in Amsterdam.,en,2017-06-18,Beatrixpark
454,4.0,Nice small park,en,2019-05-04,Beatrixpark
455,5.0,Lovely quiet place.,en,2021-10-15,Beatrixpark
456,5.0,"Food, view and atmosphere",en,2022-08-20,Beatrixpark
457,5.0,A big and nice park,en,2019-06-15,Beatrixpark
458,5.0,Enjoying the quietness 👌🏻👌🏻,en,2024-10-08,Beatrixpark
459,4.0,Hug a tree. Save a life,en,2017-10-10,Beatrixpark
460,5.0,Lovely quiet undervalued park,en,2016-06-21,Beatrixpark
461,5.0,Big spaces for picnics,en,2021-04-08,Beatrixpark
462,5.0,Wonderful to run and walk,en,2018-09-16,Beatrixpark
463,3.0,Too many dogs,en,2024-09-01,Beatrixpark
464,4.0,Nice calm peacefull patk,en,2017-05-01,Beatrixpark
465,5.0,Fresh air in the city beautiful settings,en,2019-08-25,Beatrixpark
466,5.0,My favorite park!,en,2020-09-07,Beatrixpark
467,5.0,beautiful public park,en,2016-06-14,Beatrixpark
468,5.0,This park is a hidden gem in Amsterdam.,en,2021-12-06,Beatrixpark
469,5.0,I like the lion statues with the XXX!,en,2021-12-10,Beatrixpark
470,5.0,"Nice, cozy and quiet",en,2018-04-21,Beatrixpark
471,4.0,Only the bike's should go.,en,2019-01-22,Beatrixpark
472,5.0,Our favorite park!!,en,2020-06-23,Beatrixpark
473,5.0,Quarantine go-to park for a walk of some sun,en,2020-06-02,Beatrixpark
474,5.0,Very nice place,en,2022-06-13,Beatrixpark
475,5.0,Nice park,en,2019-02-07,Beatrixpark
476,5.0,A lovely place for a stroll,en,2017-09-26,Beatrixpark
477,4.0,The place to walk your four-legged friend,en,2016-12-15,Beatrixpark
478,5.0,Very good place,en,2018-05-19,Beatrixpark
479,5.0,Beautiful park.,en,2019-07-02,Beatrixpark
480,5.0,Great place for children,en,2019-05-03,Beatrixpark
481,5.0,Beautiful park!,en,2020-10-26,Beatrixpark
482,5.0,Cool park,en,2017-12-31,Beatrixpark
483,5.0,Beautiful park!,en,2020-08-07,Beatrixpark
484,5.0,nice to be there with kids ...,en,2020-03-11,Beatrixpark
485,5.0,Very nice place,en,2020-10-02,Beatrixpark
486,5.0,lovely park.,en,2018-09-12,Beatrixpark
487,4.0,Beautiful park!,en,2019-11-01,Beatrixpark
488,5.0,Maybe the cleanest park of Amsterdam,en,2019-07-11,Beatrixpark
489,4.0,quiet and large park,en,2016-10-31,Beatrixpark
490,3.0,not so beautiful in winter,en,2021-03-19,Beatrixpark
491,4.0,Nice place to rejuvenate,en,2017-06-22,Beatrixpark
492,5.0,Nice park,en,2021-02-06,Beatrixpark
493,4.0,Nice park.,en,2018-02-24,Beatrixpark
494,5.0,Lots of joy at the park,en,2019-08-23,Beatrixpark
495,5.0,Nice and peaceful,en,2023-09-12,Beatrixpark
496,5.0,Nice park,en,2019-08-13,Beatrixpark
497,4.0,"Nature, Relaxing , clean.",en,2018-08-30,Beatrixpark
498,4.0,Nice  natural view,en,2019-07-26,Beatrixpark
499,5.0,Beautiful park,en,2021-09-23,Beatrixpark
500,4.0,Much doggos i like,en,2018-10-26,Beatrixpark
501,5.0,Nice walk,en,2019-07-07,Beatrixpark
502,5.0,One of my favorites,en,2022-10-27,Beatrixpark
503,5.0,"Green park with parrots, squirrels and rabbits",en,2016-07-10,Beatrixpark
504,4.0,Lovely nature in the middle of Amsterdam,en,2019-11-20,Beatrixpark
505,5.0,Beautiful park,en,2018-03-04,Beatrixpark
506,5.0,Top park,en,2019-05-30,Beatrixpark
507,5.0,Beautiful park,en,2020-12-30,Beatrixpark
508,4.0,I missed light pole.,en,2020-08-09,Beatrixpark
509,5.0,Beautiful park,en,2020-07-25,Beatrixpark
510,5.0,Beautiful and peaceful!,en,2020-08-02,Beatrixpark
511,5.0,Nice park!!,en,2019-09-26,Beatrixpark
512,5.0,"The most ""gezellig"" in the Netherlands 🇳🇱❤",en,2021-06-09,Beatrixpark
513,5.0,Best park of Amsterdam,en,2023-05-22,Beatrixpark
514,5.0,Magical!,en,2018-06-20,Beatrixpark
515,5.0,Great park,en,2022-05-01,Beatrixpark
516,5.0,De IJstuin is my place to be,en,2015-07-04,Beatrixpark
517,5.0,Great park,en,2016-08-19,Beatrixpark
518,5.0,Amazing park,en,2018-07-04,Beatrixpark
519,4.0,Best park in Amsterdam,en,2017-09-26,Beatrixpark
520,5.0,Beautiful and scenic,en,2022-06-06,Beatrixpark
521,4.0,Nice and peaceful,en,2022-05-11,Beatrixpark
522,5.0,beutiful park,en,2018-08-03,Beatrixpark
523,5.0,Amazing for the bebe,en,2023-09-20,Beatrixpark
524,5.0,Love it.,en,2021-08-07,Beatrixpark
525,4.0,Perfect in the summer!,en,2018-07-05,Beatrixpark
526,5.0,Gorgeous park,en,2019-07-04,Beatrixpark
527,5.0,That's my park !,en,2017-06-15,Beatrixpark
528,5.0,Love the park,en,2021-07-13,Beatrixpark
529,5.0,Love this park,en,2020-08-30,Beatrixpark
530,5.0,Beautiful Park,en,2017-06-28,Beatrixpark
531,5.0,Great view,en,2020-11-20,Beatrixpark
532,5.0,Beautiful place,en,2017-05-21,Beatrixpark
533,5.0,Love it,en,2018-10-12,Beatrixpark
534,5.0,Always the best,en,2022-08-19,Beatrixpark
535,5.0,Lovely !,en,2019-05-08,Beatrixpark
536,5.0,Lovely place,en,2019-07-27,Beatrixpark
537,5.0,Very beautiful,en,2022-07-21,Beatrixpark
538,5.0,Love it,en,2019-08-30,Beatrixpark
539,5.0,Very beautiful.,en,2019-12-29,Beatrixpark
540,5.0,Great for a run,en,2020-03-11,Beatrixpark
541,5.0,Nice pleace,en,2019-01-12,Beatrixpark
542,5.0,Chill park in the zuid.,en,2021-04-27,Beatrixpark
543,4.0,Trendy & clean !,en,2020-05-30,Beatrixpark
544,5.0,Peaceful and beautiful,en,2015-07-28,Beatrixpark
545,5.0,Ok,en,2022-07-16,Beatrixpark
546,4.0,Amazing,en,2023-01-26,Beatrixpark
547,5.0,Nice,en,2019-04-18,Beatrixpark
548,5.0,Amazing,en,2022-11-01,Beatrixpark
549,5.0,Fun,en,2022-09-11,Beatrixpark
550,5.0,Serene,en,2018-06-05,Beatrixpark
551,5.0,Hidden gem of Amsterdam.,en,2020-06-24,Beatrixpark
552,5.0,Just beautiful,en,2020-01-26,Beatrixpark
553,5.0,pleasant,en,2022-05-04,Beatrixpark
554,3.0,Greeny,en,2020-10-24,Beatrixpark
555,5.0,Pretty,en,2021-07-29,Beatrixpark
556,5.0,Beautiful,en,2019-08-24,Beatrixpark
557,5.0,Great,en,2021-03-15,Beatrixpark
558,5.0,beautiful park,en,2017-02-25,Beatrixpark
559,5.0,Nature and quiet,en,2019-12-07,Beatrixpark
560,5.0,Cool,en,2021-07-12,Beatrixpark
561,5.0,Nice,en,2019-09-16,Beatrixpark
562,5.0,Top,en,2020-10-17,Beatrixpark
563,3.0,Awakenigs,en,2019-11-09,Beatrixpark
564,4.0,Nice,en,2019-11-01,Beatrixpark
565,5.0,Surreal ❤️,en,2022-09-24,Beatrixpark
566,5.0,Cool,en,2019-05-13,Beatrixpark
567,5.0,Calm and soothing,en,2019-05-27,Beatrixpark
568,5.0,Relaxed,en,2019-06-12,Beatrixpark
569,5.0,Clean and relxing,en,2017-09-08,Beatrixpark
570,5.0,Space for all,en,2021-06-23,Beatrixpark
571,4.0,Relaxing,en,2019-06-06,Beatrixpark
572,2.0,"Favelas, maybe ?",en,2022-07-29,Beatrixpark
573,5.0,Immerse in the nature,en,2022-09-30,Beatrixpark
574,5.0,green and silence,en,2018-11-18,Beatrixpark
575,5.0,Green grreeennnn,en,2021-06-22,Beatrixpark
576,5.0,Quite park.,en,2022-08-27,Beatrixpark
577,3.0,Xxx,en,2021-07-17,Beatrixpark
578,5.0,Chill place,en,2022-05-26,Beatrixpark
579,5.0,Chill spot,en,2017-07-23,Beatrixpark
580,5.0,Gorgeousnhiddengetaway,en,2022-02-20,Beatrixpark
581,4.0,"Amsterdam, Beatrixpark, a parkot Beatrix holland királynőről nevezték el. Ezt a szép parkot 1938-ban nyitották meg, amely azóta Amszterdam egyik legrégebbi városi parkja. A park egy része 1972-ben az Amstelparkkal együtt, a Floriade kertészetnek és mezőgazdasági kiállításnak adott otthont.",en,2025-10-30,Beatrixpark
582,4.0,"Mooie, ruime en schone park. Bomen en planten uit diverse windstreken met naambordje. Waterpartijen en speelgelegenheden voor kinderen.",en,2025-08-17,Beatrixpark
583,5.0,"Fantástico parque lleno de vegetación, zonas para descansar, pasear y disfrutar del aire libre",en,2025-05-05,Beatrixpark
584,4.0,Um jardim bastante grande para descansar e aproveitar a natureza.,en,2025-05-08,Beatrixpark
585,5.0,"פארק מאוד יפה, עם מקומות מים, מקומות ישיבה, עם צל פרחים יפים מתקנים לילדים, פרחים ועוד, בילוי מושלם לכמה שעות.
A very beautiful park, with water places, places to sit, with shade, beautiful flowers, facilities for children, flowers and more, perfect entertainment for a few hours.",en,2024-08-13,Beatrixpark
586,5.0,"Потрясающе уютный парк. Много уголков для пикников, поля для выгула собак. Разнообразием флоры парк приравнивается к ботаническому саду. Хорошая, детская площадка с большим бассейном-лягушатником для детей в жаркое время года. Рядом кафе с мороженым. Прогулка в этом парке оставила незабываемые впечатления! Рекомендую!",en,2023-05-13,Beatrixpark
587,5.0,Leuk. Wel verbaasd door vele goed opgevoede en loslopende honden.,en,2025-03-23,Beatrixpark
588,5.0,"Heerlijk park in Amsterdam. We komen regelmatig bij het pierenbadje met de speeltuin (wat in de zomer elke dag van schoon water + een zwemtoezichthouder wordt voorzien). Verder ook een heerlijk park om in te wandelen. Let op, er zijn hier wel veel honden die los lopen.",en,2022-05-20,Beatrixpark
589,5.0,"Parque enorme y auténtico donde va la gente de Amsterdam a relajarse, pasear, charlar,ir en bici,ccorrer....contemplar...muy bonito. Hay una piscinita pública grande gratis pero muy poco profunda y al lado un pequeño parque para los niños",en,2025-08-20,Beatrixpark
590,5.0,Prachtig park om heerlijk te wandelen. Er is een heemtuin met allerhande lokale plantensoorten. Naast natuur kun je hier ook architectuur bewonderen. Het is dus ook een heel geschikt park om mooie foto's te maken,en,2019-08-21,Beatrixpark
591,5.0,פארק ענק ומושקע,en,2025-10-22,Beatrixpark
592,5.0,Mooi park om je hond rustig uit te laten of voor een gewonen wandeling. Het is een prettiger park om te lopen met je hond dan bijvoorbeeld het Vondelpark!,en,2024-03-06,Beatrixpark
593,5.0,"un parco meraviglioso. offrono piste ciclabili, tavoli per picnic, zone bambini,... con canali che passano tra il parco, è un bellissimo posto per riposarsi, giocare, divertirsi e passare una bella giornata!",en,2020-09-01,Beatrixpark
594,5.0,"Een heerlijke rustige plek, verwijderd van de drukte van de stad. Een park vaak vergeten door de massa, hopelijk blijft het daarbij.",en,2025-07-10,Beatrixpark
595,5.0,Heerlijk park met geweldig veel soorten bijzondere bomen en planten. Elke laatste zondag van de maand is er om 13 uur een bomenrondwandeling (winter) of rondleiding in de Artsenijhof met uitleg over medicinale planten (zomer); opgeven via de website van IVN Amsterdam (vrijwillige bijdrage na afloop) i.s.m. de Vrienden van het Beatrixpark. Deskundige gidsen Henk en Mien laten steeds iets anders zien!,en,2025-05-21,Beatrixpark
596,5.0,"Heel wat stapjes liggen hier. Grote bomen geven veel verkoeling, en voor wie kijkt is hier altijd iets nieuws te zien. Schildpadden al ontdekt?",en,2022-08-02,Beatrixpark
597,5.0,"Park, jako wielka atrakcja, jest idealnym miejscem na spędzenie czasu wolnego.

Urocza przyroda i mnóstwo zieleni.

Ciche i klimatyczne miejsce.

Miła wieczorna przechadzka oraz przejażdżka rowerem.

Cudowny odpoczynek.

Atrakcyjna okolica, wokół parku.

Miejsce zasługuje na najwyższą ocenę, czyli 5 gwiazdek.

Miejsce bardzo się mi spodobało, dlatego cieszę się, że się na nie zdecydowałem, kiedy przyjechałem do Amsterdamu.

Polecam!",en,2025-05-15,Beatrixpark
598,5.0,"Vandaag een wandeling gemaakt door het Beatrixpark en wat een fijne verrassing. Het is er rustig, groen en goed onderhouden, met genoeg plek om te zitten, wandelen of gewoon even te genieten van de natuur.

Wat het extra bijzonder maakt: je zou het niet zeggen, maar de P+R parkeergarage bij RAI zit er pal naast. Superhandig als je van buiten de stad komt — je stapt zo het park in zonder de drukte van de stad.

Ook de buurt rondom het park is mooi en rustig, met een prima uitstraling. Een echte verborgen parel in Amsterdam, perfect om tot rust te komen.",en,2025-04-30,Beatrixpark
599,5.0,"Excelente park, grande, muito verde, relax, passear com família e pet's. Vamos voltar com certeza.",en,2022-06-17,Beatrixpark
600,5.0,Comme tous les parcs d'Amsterdam c'est très propre et la fréquentation y est familiale. Le parc est spacieux et les arbres magnifiques. C'est amusant pour moi d'y être passé alors que j'y jouait en vacances étant enfant il y a maintenant 50 ans 😄.,en,2025-04-11,Beatrixpark
601,5.0,"Heel fijn park om te wandelen, erg rustig. Vooral de grote perken en vijver met zijn vaste planten verdienen mijn voorkeur in voorjaar, zomer en herfst.",en,2019-03-05,Beatrixpark
602,5.0,"Nadhera. Letos se tam poušti jen určitý počet lidi, ale fronty nejsou na příliš dlouho a stojí to za vidění .",en,2022-08-03,Beatrixpark
603,5.0,In elk jaargetijden en iedere dag weer iets leuks te zien. Als je maar wil kijken.,en,2017-09-23,Beatrixpark
604,5.0,"Un parc dans la ville c'est bien agréable et relaxant avec plusieurs cours d'eau, des lacs, grandes prairies, des arbres bien entretenus.",en,2025-05-20,Beatrixpark
605,4.0,Heel leuk oud rusgevende park in Amsterdam zuid en voor kleine kindtjes één Pierebadje en speeltuin als vermaak,en,2023-12-06,Beatrixpark
606,5.0,Prachtig stukje natuur tussen oud-zuid en de ring. Ik vind het mooier en rustiger dan het Vondelpark.,en,2020-01-04,Beatrixpark
607,4.0,"Lekker rustig een rondje door het park of in de zon genieten van de fonteinen en hondenuitlaters.
In de zomer, bij de fontein, is het natuurlijk lekker rustig genieten van een wijntje.
Geen stress en het geluid van de fontein op de achtergrond is gewoon perfect.",en,2022-03-15,Beatrixpark
